-- phpMyAdmin SQL Dump
-- version 4.8.5
-- https://www.phpmyadmin.net/
--
-- Host: localhost:3306
-- Generation Time: Jul 25, 2019 at 08:23 AM
-- Server version: 10.2.25-MariaDB
-- PHP Version: 7.2.7

SET SQL_MODE = "NO_AUTO_VALUE_ON_ZERO";
SET AUTOCOMMIT = 0;
START TRANSACTION;
SET time_zone = "+00:00";


/*!40101 SET @OLD_CHARACTER_SET_CLIENT=@@CHARACTER_SET_CLIENT */;
/*!40101 SET @OLD_CHARACTER_SET_RESULTS=@@CHARACTER_SET_RESULTS */;
/*!40101 SET @OLD_COLLATION_CONNECTION=@@COLLATION_CONNECTION */;
/*!40101 SET NAMES utf8mb4 */;

--
-- Database: `u3528779_absensi`
--

-- --------------------------------------------------------

--
-- Table structure for table `bgslider`
--

CREATE TABLE `bgslider` (
  `id` int(10) UNSIGNED NOT NULL,
  `name` varchar(191) COLLATE utf8mb4_unicode_ci NOT NULL,
  `image` varchar(191) COLLATE utf8mb4_unicode_ci NOT NULL,
  `created_at` timestamp NULL DEFAULT NULL,
  `updated_at` timestamp NULL DEFAULT NULL
) ENGINE=InnoDB DEFAULT CHARSET=utf8mb4 COLLATE=utf8mb4_unicode_ci;

-- --------------------------------------------------------

--
-- Table structure for table `category`
--

CREATE TABLE `category` (
  `id` int(10) UNSIGNED NOT NULL,
  `nama_category` varchar(191) COLLATE utf8mb4_unicode_ci NOT NULL,
  `deskripsi` text COLLATE utf8mb4_unicode_ci DEFAULT NULL,
  `created_at` timestamp NULL DEFAULT NULL,
  `updated_at` timestamp NULL DEFAULT NULL
) ENGINE=InnoDB DEFAULT CHARSET=utf8mb4 COLLATE=utf8mb4_unicode_ci;

-- --------------------------------------------------------

--
-- Table structure for table `cek_data`
--

CREATE TABLE `cek_data` (
  `id` int(11) NOT NULL,
  `id_rfid` int(11) NOT NULL
) ENGINE=MyISAM DEFAULT CHARSET=latin1;

-- --------------------------------------------------------

--
-- Table structure for table `coba`
--

CREATE TABLE `coba` (
  `id` int(10) UNSIGNED NOT NULL,
  `coba` varchar(191) COLLATE utf8mb4_unicode_ci NOT NULL,
  `created_at` timestamp NULL DEFAULT NULL,
  `updated_at` timestamp NULL DEFAULT NULL
) ENGINE=InnoDB DEFAULT CHARSET=utf8mb4 COLLATE=utf8mb4_unicode_ci;

-- --------------------------------------------------------

--
-- Table structure for table `event`
--

CREATE TABLE `event` (
  `id` int(10) UNSIGNED NOT NULL,
  `category_id` int(10) UNSIGNED DEFAULT NULL,
  `nama` varchar(191) COLLATE utf8mb4_unicode_ci NOT NULL,
  `image` varchar(191) COLLATE utf8mb4_unicode_ci NOT NULL,
  `deskripsi` text COLLATE utf8mb4_unicode_ci DEFAULT NULL,
  `created_at` timestamp NULL DEFAULT NULL,
  `updated_at` timestamp NULL DEFAULT NULL
) ENGINE=InnoDB DEFAULT CHARSET=utf8mb4 COLLATE=utf8mb4_unicode_ci;

-- --------------------------------------------------------

--
-- Table structure for table `jamaah`
--

CREATE TABLE `jamaah` (
  `id` int(10) UNSIGNED NOT NULL,
  `name` varchar(191) COLLATE utf8mb4_unicode_ci NOT NULL,
  `image` varchar(191) COLLATE utf8mb4_unicode_ci DEFAULT NULL,
  `tlpn` varchar(191) COLLATE utf8mb4_unicode_ci NOT NULL,
  `jenis_kelamin` varchar(191) COLLATE utf8mb4_unicode_ci NOT NULL,
  `alamat` tinytext COLLATE utf8mb4_unicode_ci NOT NULL,
  `kategori` varchar(191) COLLATE utf8mb4_unicode_ci NOT NULL,
  `tlpn_saudara` varchar(191) COLLATE utf8mb4_unicode_ci DEFAULT NULL,
  `tgl_lahir` date DEFAULT NULL,
  `created_at` timestamp NULL DEFAULT current_timestamp() ON UPDATE current_timestamp(),
  `updated_at` timestamp NULL DEFAULT current_timestamp()
) ENGINE=InnoDB DEFAULT CHARSET=utf8mb4 COLLATE=utf8mb4_unicode_ci;

--
-- Dumping data for table `jamaah`
--

INSERT INTO `jamaah` (`id`, `name`, `image`, `tlpn`, `jenis_kelamin`, `alamat`, `kategori`, `tlpn_saudara`, `tgl_lahir`, `created_at`, `updated_at`) VALUES
(1, 'yafi alif', NULL, '085706553390', 'Laki-Laki', 'Jalan Raya Dukuh Bima No.2, Lambangsari, Tambun Selatan, Bekasi, Jawa Barat 17514', 'itikaf', NULL, NULL, '2019-04-04 07:18:39', '2019-04-04 07:18:39'),
(2, 'yafi alif', NULL, '085706553390', 'Laki-Laki', 'Jalan Raya Dukuh Bima No.2, Lambangsari, Tambun Selatan, Bekasi, Jawa Barat 17514', 'itikaf', NULL, NULL, '2019-04-04 07:20:55', '2019-04-04 07:20:55'),
(15, 'Husnul Muksin', 'http://alikhlasdukuhbima.or.id/uploads/foto/350382970_14-04-2019_13:04:10.jpg', '08119110296', 'Laki-Laki', 'Bima Duta 3 No 12 Lambangsari Tambun Bekasi', 'full 10 hari', NULL, NULL, '2019-04-14 06:39:10', '2019-04-14 06:39:10'),
(16, 'Tyo M. Zaini', 'http://alikhlasdukuhbima.or.id/uploads/foto/430128765_14-04-2019_13:04:06.jpg', '081398929049', 'Laki-Laki', 'Bima Citra 15 -Bekasi', 'itikaf', NULL, NULL, '2019-04-14 06:43:06', '2019-04-14 06:43:06'),
(17, 'Dwipa Hertanto', 'http://alikhlasdukuhbima.or.id/uploads/foto/127977041_14-04-2019_14:04:13.jpg', '0811951903', 'Laki-Laki', 'Jl. Bima Citra 16 No. 32 Dukuh Bima', 'itikaf', NULL, NULL, '2019-04-14 07:08:13', '2019-04-14 07:08:13'),
(18, 'Dwi Suherriyadi', 'http://alikhlasdukuhbima.or.id/uploads/foto/276390477_14-04-2019_14:04:23.jpg', '0811838536', 'Laki-Laki', 'Grand Wisata', 'itikaf', NULL, NULL, '2019-04-14 07:37:23', '2019-04-14 07:37:23'),
(19, 'Aribowo', 'http://alikhlasdukuhbima.or.id/uploads/foto/929629961_14-04-2019_14:04:49.jpg', '087780903143', 'Laki-Laki', 'River Town bc 10 no 2 Grand Wisata Bekasi', 'itikaf', NULL, NULL, '2019-04-14 07:43:49', '2019-04-14 07:43:49'),
(20, 'FAIZ', 'http://alikhlasdukuhbima.or.id/uploads/foto/329963580_14-04-2019_15:04:30.jpg', '0811662711', 'Laki-Laki', 'Bima Buana V No 32 Kota Legenda', 'pulang pergi', NULL, NULL, '2019-04-14 08:02:30', '2019-04-14 08:02:30'),
(22, 'Rizal salam', 'http://alikhlasdukuhbima.or.id/uploads/foto/405219292_23-04-2019_23:04:07.jpg', '0895616034586', 'Laki-Laki', 'Brebes', 'full 10 hari', '6283877006662', '1999-06-14', '2019-04-23 16:38:08', '2019-04-23 16:38:08'),
(23, 'M. Raja Bagaskara', 'http://alikhlasdukuhbima.or.id/uploads/foto/904723799_23-04-2019_23:04:13.jpg', '085600429192', 'Laki-Laki', 'Perumahan telaga murni blok e4 no 33 . Cikarang barat', 'pulang pergi', '085777855203', '1998-10-28', '2019-04-23 16:38:14', '2019-04-23 16:38:14'),
(24, 'Supriyanto', 'http://alikhlasdukuhbima.or.id/uploads/foto/99983135_24-04-2019_00:04:32.jpg', '056669492844', 'Laki-Laki', 'Perumahan dukuh zamrud blok L3 no 28', 'pulang pergi', '085921628581', '1978-04-08', '2019-04-23 17:11:32', '2019-04-23 17:11:32'),
(25, 'amirruloh', 'http://alikhlasdukuhbima.or.id/uploads/foto/141142282_24-04-2019_01:04:26.jpg', '0', 'Laki-Laki', 'kp. cibitung telkom rt.04/05 kel. paduranan mustika jaya kota bekasi', 'pulang pergi', '1', '1995-02-04', '2019-04-23 18:41:27', '2019-04-23 18:41:27'),
(26, 'Septian Enggar Susanto', 'http://alikhlasdukuhbima.or.id/uploads/foto/151161740_24-04-2019_01:04:41.jpeg', '085735133736', 'Laki-Laki', 'PERUM GRAND RESIDENCE CITY CL TIRTAYASA AC 18/25 BEKASI', 'pulang pergi', '085815172206', '1989-09-28', '2019-04-23 18:49:41', '2019-04-23 18:49:41'),
(27, 'Ami ade kurniawan', 'http://alikhlasdukuhbima.or.id/uploads/foto/881183418_24-04-2019_01:04:28.jpeg', '081290815908', 'Laki-Laki', 'Margahayu jaya blok b 277', 'full 10 hari', '081398348986', '1988-01-29', '2019-04-23 18:52:28', '2019-04-23 18:52:28'),
(28, 'Muhammad Roid Rafii', 'http://alikhlasdukuhbima.or.id/uploads/foto/832244088_24-04-2019_02:04:33.png', '081292837155', 'Laki-Laki', 'Bumi Teluk Jambe Blok.G/235 RT.001 RW.014 Kel.sukaluyu Kec.Telukjambe Timur Kab.Karawang', 'full 10 hari', '081310547887', '2000-08-19', '2019-04-23 19:22:33', '2019-04-23 19:22:33'),
(29, 'Khansa Nailah', NULL, '081292837155', 'Perempuan', 'Bumi Teluk Jambe Blok.G/235 RT.001 RW.014 Kel.sukaluyu Kec.Telukjambe Timur Kab.Karawang', 'full 10 hari', '081310547887', '2005-10-02', '2019-04-23 19:27:59', '2019-04-23 19:27:59'),
(30, 'Ganjar pradesha', 'http://alikhlasdukuhbima.or.id/uploads/foto/771865813_24-04-2019_02:04:43.jpg', '081248480549', 'Laki-Laki', 'Perum taman sentosa J18-6 Cikarang', 'full 10 hari', '081220208893', '1980-12-30', '2019-04-23 19:32:44', '2019-04-23 19:32:44'),
(31, 'Wahyudi Prayanto', NULL, '085810859449', 'Laki-Laki', 'Perum. Bekasi Timur Regensi Blok C 2 no 2 (cluster corundum) cimuning mustikajaya bekasi', 'pulang pergi', '081282093010', '1972-05-02', '2019-04-23 19:49:12', '2019-04-23 19:49:12'),
(32, 'Andi Andalia Ratna Sari', NULL, '081282093010', 'Perempuan', 'Perum. Bekasi Timur Regensi Blok C 2 no 2 (cluster corundum) cimuning mustikajaya bekasi', 'pulang pergi', '085810859449', '1981-06-02', '2019-04-23 19:50:24', '2019-04-23 19:50:24'),
(33, 'Naila Najla Nisrina', NULL, '081282093010', 'Perempuan', 'Perum. Bekasi Timur Regensi Blok C 2 no 2 (cluster corundum) cimuning mustikajaya bekasi', 'pulang pergi', NULL, '2005-07-18', '2019-04-23 19:51:28', '2019-04-23 19:51:28'),
(34, 'Raisa Zahra Salsabila', NULL, '081282093010', 'Perempuan', 'Perum. Bekasi Timur Regensi Blok C 2 no 2 (cluster corundum) cimuning mustikajaya bekasi', 'pulang pergi', NULL, '2008-04-13', '2019-04-23 19:52:27', '2019-04-23 19:52:27'),
(35, 'Hasanijah', NULL, '081282093010', 'Perempuan', 'Perum. Bekasi Timur Regensi Blok C 2 no 2 (cluster corundum) cimuning mustikajaya bekasi', 'pulang pergi', NULL, '1944-05-08', '2019-04-23 19:54:15', '2019-04-23 19:54:15'),
(36, 'Dwi wahyuni', NULL, '081220224602', 'Perempuan', 'Bapak Agus/ ibu Dwi  Perumahan Mutiara Gading timur 2,RT:008 RW :028 ,Blok S7 No.025 Kelurahan Mustika Jaya Kecamatan Mustika Jaya Bekasi-  081220224602', 'pulang pergi', '081281820525', '1989-07-22', '2019-04-23 19:59:32', '2019-04-23 19:59:32'),
(37, 'Agus yubianto', NULL, '081281820525', 'Laki-Laki', 'Bapak Agus/ ibu Dwi  Perumahan Mutiara Gading timur 2,RT:008 RW :028 ,Blok S7 No.025 Kelurahan Mustika Jaya Kecamatan Mustika Jaya Bekasi-  081220224602', 'pulang pergi', '081220224602', '1991-08-13', '2019-04-23 20:01:51', '2019-04-23 20:01:51'),
(38, 'Hendra Abu Barra', 'http://alikhlasdukuhbima.or.id/uploads/foto/762184170_24-04-2019_03:04:13.jpg', '081319838299', 'Laki-Laki', 'kp.nambo rt 12 rw 06 desa sukasejati cikarang selatan bekasi', 'full 10 hari', '085294770042', '1986-01-19', '2019-04-23 20:24:13', '2019-04-23 20:24:13'),
(39, 'Ahmad Fahmi', NULL, '081317684736', 'Laki-Laki', 'Perum. Grand Cikarang City Blok F23/12 cikarang utara kab. Bekasi', 'pulang pergi', '081219680400', '1996-12-19', '2019-04-23 20:30:31', '2019-04-23 20:30:31'),
(40, 'Ibnu Qosim', 'http://alikhlasdukuhbima.or.id/uploads/foto/859390743_24-04-2019_03:04:54.jpg', '0811137314', 'Laki-Laki', 'Taman Sentosa H1/38, Cikarang Selatan, Bekasi 17550', 'full 10 hari', '082114358971', '1969-01-08', '2019-04-23 20:34:54', '2019-04-23 20:34:54'),
(41, 'Siti Nuraini Trihartini', NULL, '0811137315', 'Perempuan', 'Taman Sentosa H1/38, Cikarang Selatan, Bekasi 17550', 'full 10 hari', '082114358971', '1969-03-14', '2019-04-23 20:37:00', '2019-04-23 20:37:00'),
(42, 'Rizki Rachman Muntohary', 'http://alikhlasdukuhbima.or.id/uploads/foto/459832748_24-04-2019_03:04:40.jpg', '087715233531', 'Laki-Laki', 'Rawalumbu jembatan 12', 'full 10 hari', '081281090442', '1996-10-19', '2019-04-23 20:38:40', '2019-04-23 20:38:40'),
(43, 'Tessa Lantika Putri', NULL, '081287039491', 'Perempuan', 'Taman Sentosa H1/38 Cikarang Selatan, Bekasi 17550', 'full 10 hari', '082114358971', '1994-10-10', '2019-04-23 20:40:12', '2019-04-23 20:40:12'),
(44, 'Misbakhul Aan', 'http://alikhlasdukuhbima.or.id/uploads/foto/350880887_24-04-2019_03:04:18.jpg', '082299855609', 'Laki-Laki', 'Dukuh zamrud blok i 25/26 kota legenda', 'full 10 hari', '6281383006822', '1979-11-06', '2019-04-23 20:41:18', '2019-04-23 20:41:18'),
(45, 'sumardi', NULL, '089637033632', 'Laki-Laki', 'Mutiara Gading Timur Blok G1/35', 'full 10 hari', '02182613668', '1976-08-24', '2019-04-23 20:41:27', '2019-04-23 20:41:27'),
(46, 'Eldyn Mohammad Qosim', 'http://alikhlasdukuhbima.or.id/uploads/foto/816459280_24-04-2019_03:04:38.jpg', '081318596380', 'Laki-Laki', 'Taman Sentosa H1/38, Cikarang Selatan, Bekasi 17550', 'full 10 hari', '082114358971', '1997-11-19', '2019-04-23 20:42:38', '2019-04-23 20:42:38'),
(47, 'Kadis Kartodihardjo', NULL, '082144956187', 'Laki-Laki', 'Mutiara Gading Timur Blok G1/35', 'full 10 hari', '089637033632', '1943-12-31', '2019-04-23 20:50:37', '2019-04-23 20:50:37'),
(48, 'Takdir', 'http://alikhlasdukuhbima.or.id/uploads/foto/793782603_24-04-2019_03:04:32.jpeg', '081396833538', 'Laki-Laki', 'Grand residence cluster tirtayasa', 'full 10 hari', '081220555023', '1988-04-30', '2019-04-23 20:51:32', '2019-04-23 20:51:32'),
(49, 'Bima Fatra Ramadhan', 'http://alikhlasdukuhbima.or.id/uploads/foto/364865919_24-04-2019_03:04:55.jpeg', '081281196067', 'Laki-Laki', 'Perum. Grand Regency blok B2 no 18 Padurenan, Mustika Jaya, Kota Bekasi', 'pulang pergi', '081387830654', '1996-02-04', '2019-04-23 20:51:55', '2019-04-23 20:51:55'),
(50, 'Dhiaurrahman Faiz Winardi', NULL, '089664764114', 'Laki-Laki', 'Mutiara Gading Timur Blok G1/35', 'full 10 hari', '089637033632', '2006-06-06', '2019-04-23 20:52:28', '2019-04-23 20:52:28'),
(51, 'Prinsa pamedar', NULL, '087771674164', 'Laki-Laki', 'Komplek Depsos BRSLU Budhidharma bulakkapal JL. HM Djoyomartono No.19 Margahayu Bekasi Timur', 'pulang pergi', '081210248455', '1983-08-02', '2019-04-23 20:54:07', '2019-04-23 20:54:07'),
(52, 'Kusmanto', 'http://alikhlasdukuhbima.or.id/uploads/foto/821245816_24-04-2019_03:04:51.jpg', '08119937280', 'Laki-Laki', 'Dukuh zamrud blok L5 no.7', 'full 10 hari', '0218254456', '1975-09-04', '2019-04-23 20:55:51', '2019-04-23 20:55:51'),
(53, 'Subiyanto', 'http://alikhlasdukuhbima.or.id/uploads/foto/803337895_24-04-2019_03:04:05.jpg', '081282259292', 'Laki-Laki', 'Dukuh Zamrud Blok P1 No. 15 Kel. Padurenan Mustikajaya Kota Bekasi', 'pulang pergi', '081296342177', '2000-03-09', '2019-04-23 20:58:05', '2019-04-23 20:58:05'),
(55, 'Rizieq nurfatah', NULL, '085921628581', 'Laki-Laki', 'Perumahan dukuh zamrud blok L3 no 28', 'pulang pergi', '089669492844', '2003-03-23', '2019-04-23 20:59:59', '2019-04-23 20:59:59'),
(56, 'Adian fata ahsanitaqwim', NULL, '085974418088', 'Laki-Laki', 'Dukuh zamrud blok L5 no.7', 'full 10 hari', '0218254456', '2004-07-20', '2019-04-23 21:01:21', '2019-04-23 21:01:21'),
(57, 'Juhendra', 'http://alikhlasdukuhbima.or.id/uploads/foto/807815219_24-04-2019_04:04:34.jpg', '085921494004', 'Laki-Laki', 'Grand residence cluster Prapanca 1 Bd 34 / 6', 'pulang pergi', NULL, '1986-05-07', '2019-04-23 21:26:34', '2019-04-23 21:26:34'),
(58, 'Fika nur fitriani', NULL, '082311880552', 'Perempuan', 'Perumahan mayanggi blok k1 no 17 RT 13/08 Bekasi timur', 'full 10 hari', '081380590519', '1998-02-11', '2019-04-23 21:34:53', '2019-04-23 21:34:53'),
(59, 'Denni Kurnia', 'http://alikhlasdukuhbima.or.id/uploads/foto/399334037_24-04-2019_04:04:04.jpg', '081212055193', 'Laki-Laki', 'Jl. P.Maluku 1 No. 91 RT.001 RW.009 Kelurahan Aren Jaya Kecamatan Bekasi Timur', 'pulang pergi', '081212055173', '1983-11-05', '2019-04-23 21:40:04', '2019-04-23 21:40:04'),
(60, 'Desy Suliaty', NULL, '081584750517', 'Perempuan', 'Perum graha mustika media blok k2 no 35 setu bekasi', 'pulang pergi', '081517174468', '1980-12-02', '2019-04-23 21:54:18', '2019-04-23 21:54:18'),
(61, 'Aji Wahyu Prasetiyo', NULL, '088291793663', 'Laki-Laki', 'kampung karang mulya, RT 008/ RW 08, Desa karang satria, Kecamatan Tambun utara,  Bekasi', 'full 10 hari', NULL, '1999-12-01', '2019-04-23 22:01:07', '2019-04-23 22:01:07'),
(62, 'Budi Utomo', NULL, '081283405750', 'Laki-Laki', 'Metland Cibitung Cluster Taman Pluit Blok R10 No. 12, Wanajaya - Cibitung, Kab. Bekasi', 'full 10 hari', '085326334066', '1994-03-11', '2019-04-23 22:02:05', '2019-04-23 22:02:05'),
(63, 'Ath thaariq akbar', 'http://alikhlasdukuhbima.or.id/uploads/foto/825180476_24-04-2019_05:04:35.jpg', '085218541835', 'Laki-Laki', 'Perumahan permata abadi, ds pedangan, kec dukuhwaru, kab. Tegal', 'full 10 hari', '081287039808', '2001-01-09', '2019-04-23 22:17:36', '2019-04-23 22:17:36'),
(64, 'Muhammad Abdussalam Al Hafidz', 'http://alikhlasdukuhbima.or.id/uploads/foto/373481834_24-04-2019_05:04:21.jpg', '085840373955', 'Laki-Laki', 'Rawalumbu, Bekasi', 'pulang pergi', '081389389010', '2000-05-09', '2019-04-23 22:35:21', '2019-04-23 22:35:21'),
(65, 'Nasim', 'http://alikhlasdukuhbima.or.id/uploads/foto/289300665_24-04-2019_05:04:50.jpg', '087885660644', 'Laki-Laki', 'Kp. Lubang Buaya Rt 001/005 Kec.Setu Kab.Bekasi', 'full 10 hari', '087888853488', NULL, '2019-04-23 22:48:50', '2019-04-23 22:48:50'),
(66, 'suroso', 'http://alikhlasdukuhbima.or.id/uploads/foto/986368811_24-04-2019_05:04:19.jpg', '081519109395', 'Laki-Laki', 'dukuh zamrud blok Q1 No.9 rt 03 rw 013 Bekasi', 'pulang pergi', '085883465323', '1962-07-14', '2019-04-23 22:59:20', '2019-04-23 22:59:20'),
(67, 'Marulloh', 'http://alikhlasdukuhbima.or.id/uploads/foto/136607295_24-04-2019_06:04:12.jpg', '081283188514', 'Laki-Laki', 'Perumahan cahaya darussalam blok A1 no 2 setu, Bekasi', 'full 10 hari', '085814004535', '1989-10-20', '2019-04-23 23:02:12', '2019-04-23 23:02:12'),
(68, 'Misbakhul Aan Fitri andi', 'http://alikhlasdukuhbima.or.id/uploads/foto/284423948_24-04-2019_06:04:48.jpg', '082299855609', 'Laki-Laki', 'Dukuh zamrud blok i 25 no. 26 kota legenda', 'full 10 hari', '6281383006822', '1979-11-06', '2019-04-23 23:12:48', '2019-04-23 23:12:48'),
(69, 'Samsul salam bin sapri', NULL, '081210004003', 'Laki-Laki', 'Kp.legon rt 03 rw 04 jatimulya tambun selatan', 'pulang pergi', '087885009536', '1977-06-15', '2019-04-23 23:20:30', '2019-04-23 23:20:30'),
(70, 'Amalia Virgianita', NULL, '083851771975', 'Perempuan', 'Tridaya Indah 2 Blok C7 9 sumberjaya, tambun selatan, Bekasi', 'full 10 hari', '081287138011', '2002-08-08', '2019-04-23 23:33:09', '2019-04-23 23:33:09'),
(71, 'Djumadi Setiawan', 'http://alikhlasdukuhbima.or.id/uploads/foto/348052772_24-04-2019_06:04:23.jpg', '083815475030', 'Laki-Laki', 'Tridaya Indah 2 Blok C7 9 sumberjaya, tambun selatan, Bekasi', 'full 10 hari', '083851771975', '1977-11-25', '2019-04-23 23:42:23', '2019-04-23 23:42:23'),
(73, 'Dalila Rahmawati Ester', NULL, '081223687823', 'Perempuan', 'Taman Setia Mekar Jl. Mawar Raya M4/27 Kel. Setia Mekar, Kec. Tambun Selatan, Kab. Bekasi', 'pulang pergi', '08127360751', '1993-02-22', '2019-04-24 00:43:33', '2019-04-24 00:43:33'),
(74, 'MUHAMMAD RIDWAN', 'http://alikhlasdukuhbima.or.id/uploads/foto/988428036_24-04-2019_07:04:48.jpg', '082280888180', 'Laki-Laki', 'Jln. Kampung Kandang pemancingan', 'pulang pergi', '082280888280', '1989-11-05', '2019-04-24 00:55:49', '2019-04-24 00:55:49'),
(75, 'Diapit Adhari Agustina', 'http://alikhlasdukuhbima.or.id/uploads/foto/313263828_24-04-2019_08:04:15.jpeg', '081380111406', 'Laki-Laki', 'BTN Kodam Blok C9/10 Rt004/013 Kec/Kel Mustika Jaya Bekasi', 'full 10 hari', '081380111407', '1986-08-16', '2019-04-24 01:03:15', '2019-04-24 01:03:15'),
(76, 'MOHAMMAD SYAMSUL ARIFIN', 'http://alikhlasdukuhbima.or.id/uploads/foto/181806053_24-04-2019_08:04:36.jpg', '081316200873', 'Laki-Laki', 'PERUM KODAM MUSTIKAJAYA BLOK B7/2, MUSTIKA JAYA', 'pulang pergi', '081316200873', '1986-04-21', '2019-04-24 01:53:36', '2019-04-24 01:53:36'),
(77, 'MUHAMMAD ABDI ROHMAN HARITSI', 'http://alikhlasdukuhbima.or.id/uploads/foto/607875438_24-04-2019_09:04:55.jpg', '087770267700', 'Laki-Laki', 'MANGUN JAYA INDAH 2 BLOK C4 NO.06 RW.015 , TAMBUN SELATAN', 'full 10 hari', '081298245131', '1996-07-29', '2019-04-24 02:01:55', '2019-04-24 02:01:55'),
(78, 'laela emawati', NULL, '085883465323', 'Perempuan', 'dukuh zamrud blok Q1 No.9 rt 03 rw 013 Bekasi', 'pulang pergi', '081519109395', '1967-01-02', '2019-04-24 02:13:23', '2019-04-24 02:13:23'),
(80, 'Firmansyah', 'http://alikhlasdukuhbima.or.id/uploads/foto/879502643_24-04-2019_09:04:50.jpg', '089527010691', 'Laki-Laki', 'Kp. Darmajaya, rt. 02/rw. 03, setiadarma, tambun selatan', 'full 10 hari', '081806640446', '1981-12-14', '2019-04-24 02:15:51', '2019-04-24 02:15:51'),
(81, 'sarah fadhilah', NULL, '085899921175', 'Perempuan', 'dukuh zamrud blok Q1 No.9 rt 03 rw 013 Bekasi', 'pulang pergi', '085883465323', '1999-12-13', '2019-04-24 02:22:06', '2019-04-24 02:22:06'),
(83, 'Faris dzu khairil muna', NULL, '089527010691', 'Laki-Laki', 'Kp. Darmajaya, rt. 02/rw. 03, setiadarma, tambun selatan', 'full 10 hari', '081806640446', '2009-01-01', '2019-04-24 02:25:01', '2019-04-24 02:25:01'),
(84, 'Panji erlangga', 'http://alikhlasdukuhbima.or.id/uploads/foto/439968291_24-04-2019_09:04:39.jpg', '081281235358', 'Laki-Laki', 'Perum kodam mustika jaya b7 no.6 rt/rw 003/013', 'pulang pergi', '081315832917', '1992-11-17', '2019-04-24 02:31:40', '2019-04-24 02:31:40'),
(85, 'Tedi maryadi', 'http://alikhlasdukuhbima.or.id/uploads/foto/337609963_24-04-2019_10:04:40.jpg', '08988313702', 'Laki-Laki', 'Jl simpang tiga setu no.18 kp bahagia rt 002 rw 004 (yayasan al kamilah) tambun selatan bekasi 17511', 'pulang pergi', '08157004372', '1983-03-03', '2019-04-24 03:42:40', '2019-04-24 03:42:40'),
(86, 'Ricky illahi', NULL, '087776483659', 'Laki-Laki', 'Kp. Cibitung kaum samping PT sanova', 'full 10 hari', '085714209209', '1997-09-15', '2019-04-24 04:24:46', '2019-04-24 04:24:46'),
(87, 'Subhan', 'http://alikhlasdukuhbima.or.id/uploads/foto/820825340_24-04-2019_11:04:06.jpg', '082113342225', 'Laki-Laki', 'Jl. P. Maluku Raya Blok C1 No. 15, Aren Jaya Bekasi Timur', 'full 10 hari', '085710909005', '1971-12-29', '2019-04-24 04:31:07', '2019-04-24 04:31:07'),
(88, 'Ricky Syahrial', 'http://alikhlasdukuhbima.or.id/uploads/foto/756627307_24-04-2019_11:04:14.jpg', '081290492486', 'Laki-Laki', 'Jl. Karya Logam Kp. Legon Kel. Jatimulya Kec. Tambun Selatan Kab. Bekasi 17515 Jawa Barat', 'pulang pergi', '081387260490', '1992-03-21', '2019-04-24 04:42:14', '2019-04-24 04:42:14'),
(89, 'Idham Rabbani Muhammad', NULL, '082113342225', 'Laki-Laki', 'Jl. P. Maluku Raya Blok C1 No. 15 Aren Jaya, Bekasi Timur', 'full 10 hari', '0816100090', '2006-09-26', '2019-04-24 04:59:07', '2019-04-24 04:59:07'),
(90, 'M NUGRAHA PRATAMA', 'http://alikhlasdukuhbima.or.id/uploads/foto/673017826_24-04-2019_12:04:18.jpg', '081222292885', 'Laki-Laki', 'Perum Duren Jaya Jalan Candi Borobudur Blok D 238, Bekasi Timur', 'pulang pergi', '085311305585', '1984-12-05', '2019-04-24 05:01:18', '2019-04-24 05:01:18'),
(92, 'Khumaidi Z', 'http://alikhlasdukuhbima.or.id/uploads/foto/125105395_24-04-2019_12:04:12.jpg', '081212339596', 'Laki-Laki', 'Jl. Kusuma timur C A7 no. 53', 'full 10 hari', '081286917806', '1962-05-10', '2019-04-24 05:18:13', '2019-04-24 05:18:13'),
(93, 'Fatimah', 'http://alikhlasdukuhbima.or.id/uploads/foto/310881436_24-04-2019_12:04:02.jpg', '081318911811', 'Perempuan', 'Jl. Kusuma timur C A7 no. 53', 'full 10 hari', '081286917806', '1967-12-01', '2019-04-24 05:19:02', '2019-04-24 05:19:02'),
(95, 'Adwiya fitria faza', 'http://alikhlasdukuhbima.or.id/uploads/foto/585885468_24-04-2019_12:04:35.jpg', '081384677224', 'Perempuan', 'Jl. Kusuma timur C A7 no. 53', 'full 10 hari', '081286917806', '2000-12-27', '2019-04-24 05:21:36', '2019-04-24 05:21:36'),
(97, 'suwarjo', NULL, '081513008487', 'Laki-Laki', 'Mgt blok g1 no.25 rt 006 rw 033 mustikajaya kota bekasi', 'pulang pergi', '082288226645', '1967-07-06', '2019-04-24 05:31:12', '2019-04-24 05:31:12'),
(98, 'Rio Pradifta Suharjo', 'http://alikhlasdukuhbima.or.id/uploads/foto/298936083_24-04-2019_12:04:34.jpg', '082242906369', 'Laki-Laki', 'Jl. Puyuh 8 Blok F No. 242', 'pulang pergi', '087881369878', '1993-01-04', '2019-04-24 05:31:34', '2019-04-24 05:31:34'),
(99, 'Yuda Findo prastiwa', 'http://alikhlasdukuhbima.or.id/uploads/foto/188689706_24-04-2019_12:04:31.jpg', '082288226645', 'Laki-Laki', 'Taman alamanda 2 blok eb1 no 27 mustika sari mustika jaya bekasi', 'full 10 hari', '0811919032', '1997-02-12', '2019-04-24 05:46:34', '2019-04-24 05:46:34'),
(100, 'Zaky Abu Naizar', NULL, '081908337701', 'Laki-Laki', 'Cluster Jabung Indah Blok B 06', 'pulang pergi', '082299859911', '1986-01-25', '2019-04-24 05:47:04', '2019-04-24 05:47:04'),
(101, 'Nazifah Ratsanjani', NULL, '0811919032', 'Perempuan', 'Mgt', 'full 10 hari', '08119192291', '1998-03-19', '2019-04-24 06:01:08', '2019-04-24 06:01:08'),
(102, 'Harry Prihatin', 'http://alikhlasdukuhbima.or.id/uploads/foto/317878980_24-04-2019_13:04:13.jpg', '081384402741', 'Laki-Laki', 'Jl.Rusa1/G/No.33 Perum.Cikarang Baru. Cikarang timur', 'full 10 hari', '085101343522', '1974-04-16', '2019-04-24 06:14:14', '2019-04-24 06:14:14'),
(103, 'Arfah', NULL, '081315790132', 'Perempuan', 'Mgt blok g1 no.25 rt 006 rw 033 mustikajaya kota bekasi', 'pulang pergi', '081513008487', '1973-03-17', '2019-04-24 06:17:02', '2019-04-24 06:17:02'),
(104, 'haritza abdillah zayyan', NULL, '081315790132', 'Laki-Laki', 'Mutiara Gading Blok G1 no 25 mustikajaya bekasi', 'pulang pergi', '081513008487', '2006-12-18', '2019-04-24 06:19:59', '2019-04-24 06:19:59'),
(106, 'Humam Mufti', NULL, '081315790132', 'Laki-Laki', 'Mutiara Gading Blok G1 no 25 mustikajaya bekasi', 'pulang pergi', '081513008487', '2000-12-28', '2019-04-24 06:22:09', '2019-04-24 06:22:09'),
(108, 'Grace Thamrin', 'http://alikhlasdukuhbima.or.id/uploads/foto/677826242_24-04-2019_13:04:25.jpg', '081288282310', 'Perempuan', 'JL.Rusa 1/G/33 Perum. Cikarang baru-Cikarang timur', 'full 10 hari', '081314939304', '1978-12-13', '2019-04-24 06:24:26', '2019-04-24 06:24:26'),
(109, 'indra isnaeni', 'https://alikhlasdukuhbima.or.id/uploads/foto/406953536_24-04-2019_13:04:04.jpg', '081294066178', 'Laki-Laki', 'kp.cibening rt003/004 cibening setu bekasi', 'full 10 hari', '08988837725', '1982-05-12', '2019-04-24 06:48:04', '2019-04-24 06:48:04'),
(110, 'Vio Romalia', NULL, '081295704035', 'Perempuan', 'Jl. Industri Kp Kongsi Gang Dahlia No59 Rt 002 Rw 008 Kel Cikarang Kota Kec Cikarang Utara', 'full 10 hari', '082123528530', '1997-12-08', '2019-04-24 06:49:33', '2019-04-24 06:49:33'),
(111, 'Darti', NULL, '085729471745', 'Perempuan', 'Perum Bulak  Kapal Permai Blok Aj 2 No 31 RT 02 Rw 14 Jatimulya, Tambun Selatan, Bekasi', 'pulang pergi', NULL, '1996-06-26', '2019-04-24 06:58:00', '2019-04-24 06:58:00'),
(112, 'Enzie Yasmin', NULL, '085288255972', 'Perempuan', 'Cluster kampung karangasih (rumah pertama), jl.swadaya II. Cikarang utara, kab. Bekasi', 'pulang pergi', '081807795601', '1993-10-29', '2019-04-24 07:00:01', '2019-04-24 07:00:01'),
(123, 'Bagus Panji Pangestu', 'http://alikhlasdukuhbima.or.id/uploads/foto/720513497_24-04-2019_17:04:07.jpg', '087700240004', 'Laki-Laki', 'Jl. P. Buton 3 No. 29 Rt. 001/018 Kel. Aren Jaya Kec. Bekasi Timur Kota Bekasi', 'pulang pergi', '08119660142', '1998-06-17', '2019-04-24 10:01:07', '2019-04-24 10:01:07'),
(124, 'Nasuha bin abdullatif', NULL, '085817285283', 'Laki-Laki', 'Kp.kalijambe,Rt/Rw:04/04', 'pulang pergi', '081283129033', '1978-11-15', '2019-04-24 16:00:25', '2019-04-24 16:00:25'),
(125, 'Achmad Ramadhani Revanda', 'http://alikhlasdukuhbima.or.id/uploads/foto/679382190_25-04-2019_00:04:55.jpg', '083876695882', 'Laki-Laki', 'Jl. Pulau karimun jawa 4 rt 04/13 kec. Bekasi Timur kel. Aren Jaya 17111 Kota Bekasi.', 'full 10 hari', '087879102669', '1998-12-23', '2019-04-24 17:39:55', '2019-04-24 17:39:55'),
(126, 'yuniarti', NULL, '081316203791', 'Perempuan', 'ponpes tahfidz daarussunnah parung', 'full 10 hari', '083878624290', '1965-06-02', '2019-04-24 18:10:28', '2019-04-24 18:10:28'),
(128, 'Rania Hidayani Fimasadien', NULL, '089646789565', 'Perempuan', 'Perumahan bumisanipermai blok h4 no 12a rt 002 rw 014', 'full 10 hari', '081285645636', '2000-11-04', '2019-04-24 18:58:38', '2019-04-24 18:58:38'),
(129, 'Sonia Kurniawati', NULL, '088210208229', 'Perempuan', 'Perum. Papan mas blok F 43/5 RT05/09 kel. Setia Mekar kec. Tambun selatan kab. Bekasi 17510', 'full 10 hari', NULL, '2000-10-06', '2019-04-24 19:03:35', '2019-04-24 19:03:35'),
(130, 'Ferni Rachma Kusnawan', NULL, '0816100090', 'Perempuan', 'Jl. P. Maluku Raya Blok C1 No. 15, Aren Jaya Bekasi Timur', 'full 10 hari', '082113342225', '1981-06-19', '2019-04-24 20:16:30', '2019-04-24 20:16:30'),
(131, 'Anasya Vriescika Aurelia Ramadhani', NULL, '0816100090', 'Perempuan', 'Jl. Maluku Raya Blok C1 No. 15 Aren Jaya Bekasi Timur', 'pulang pergi', '082113342225', '2004-11-12', '2019-04-24 20:19:34', '2019-04-24 20:19:34'),
(132, 'Martono', NULL, '08974837885', 'Laki-Laki', 'Babelan', 'pulang pergi', '081385529356', '1977-03-04', '2019-04-24 21:43:09', '2019-04-24 21:43:09'),
(133, 'Endang Suhendi', 'https://alikhlasdukuhbima.or.id/uploads/foto/815024567_25-04-2019_05:04:12.jpg', '085886081863', 'Laki-Laki', 'kp.cibening rt003/004 cibening setu bekasi', 'full 10 hari', '082299788212', '1961-07-07', '2019-04-24 22:19:12', '2019-04-24 22:19:12'),
(134, 'Adrian Lisfiansyah', '', '081210035521', 'Laki-Laki', 'Jalan setia 2a no 56 b jatiwaringin pondok gede', 'full 10 hari', '0811904072', '1996-09-16', '2019-04-24 23:34:21', '2019-04-24 23:34:21'),
(135, 'Sulastri', NULL, '085101349654', 'Perempuan', 'Perum pesona Pulo indah blok g 20 RT 04 Rw  53 Sumberjaya Tambun Selatan Bekasi', 'full 10 hari', '085766920497', '1984-02-04', '2019-04-25 01:51:07', '2019-04-25 01:51:07'),
(136, 'Boyke Thamrin', 'http://alikhlasdukuhbima.or.id/uploads/foto/126478338_25-04-2019_08:04:44.jpg', '081388165871', 'Laki-Laki', 'Jl. Industri No.59 Rt.02 Rw.08 Cikarang Utara 17530', 'pulang pergi', '081318198626', '1979-11-05', '2019-04-25 01:56:44', '2019-04-25 01:56:44'),
(137, 'Faradilla putri nirwana', NULL, '082218301311', 'Perempuan', 'Jl.intan 8 blok ea 21 no.1 musktika karang satria, tambun utara bekasi', 'pulang pergi', '081293803826', '2000-02-09', '2019-04-25 02:15:31', '2019-04-25 02:15:31'),
(138, 'Nurmillah', NULL, '089512462028', 'Perempuan', 'Tangerang dasanah indah', 'full 10 hari', '081381182801', '2000-04-03', '2019-04-25 04:09:42', '2019-04-25 04:09:42'),
(141, 'Miftahul syifa', NULL, '085723533521', 'Perempuan', 'Bekasi timur tambun selatan', 'full 10 hari', '082245056824', '2001-01-31', '2019-04-25 04:15:43', '2019-04-25 04:15:43'),
(142, 'Marsan maulana', 'http://alikhlasdukuhbima.or.id/uploads/foto/161430065_25-04-2019_12:04:15.jpg', '087881080181', 'Laki-Laki', 'Kp.rawa banteng/Rt.001/014/desa.cibuntu/kec.cibitung/kab.bekasi', 'pulang pergi', '089695231859', '1980-07-08', '2019-04-25 05:47:15', '2019-04-25 05:47:15'),
(144, 'Tania (ummu yusuf )', NULL, '089602899087', 'Perempuan', 'Cimuning, mustika jaya, Bekasi', 'full 10 hari', NULL, '1979-07-10', '2019-04-25 06:13:59', '2019-04-25 06:13:59'),
(145, 'Irsyad Kamil', NULL, '089682719953', 'Laki-Laki', 'Cimuning, mustika jaya, Bekasi', 'full 10 hari', NULL, '1999-06-15', '2019-04-25 06:20:16', '2019-04-25 06:20:16'),
(146, 'Muhammad Sahru Romadhon', NULL, '08999135851', 'Laki-Laki', 'Cimuning, mustika jaya, Bekasi', 'full 10 hari', NULL, '2003-11-25', '2019-04-25 06:27:25', '2019-04-25 06:27:25'),
(147, 'Ayu Wulandari', NULL, '085777855203', 'Perempuan', 'Perumahan telaga murni blok e4 no 33 . Cikarang barat', 'pulang pergi', '085600429192', '1999-01-08', '2019-04-25 07:02:56', '2019-04-25 07:02:56'),
(148, 'Ajeng Permatasari', NULL, '6289668760062', 'Perempuan', 'Perumahan papan mas blok G52 No.11 mangun jaya tambun selatan', 'pulang pergi', '08128397647', '2000-02-19', '2019-04-25 07:28:12', '2019-04-25 07:28:12'),
(150, 'ROMADI', 'http://alikhlasdukuhbima.or.id/uploads/foto/674560439_25-04-2019_14:04:41.jpg', '085881666680', 'Laki-Laki', 'perum mekarsari permai 1 jl.melati 3 blok c5 no.8 tambun selatan bekasi', 'full 10 hari', '085710407081', '1988-05-15', '2019-04-25 07:35:42', '2019-04-25 07:35:42'),
(152, 'muhammad yudha kusuma', NULL, '082113665732', 'Laki-Laki', 'MGT BLOK G 7 no 23 mustika jaya', 'pulang pergi', NULL, '2004-12-30', '2019-04-25 17:00:18', '2019-04-25 17:00:18'),
(153, 'Muhammad Ramdlan Mubarok', 'http://alikhlasdukuhbima.or.id/uploads/foto/637773778_26-04-2019_01:04:28.jpg', '081212540274', 'Laki-Laki', 'Perum MGT Blok F5 No 28. Mustika Jaya. Bekasi', 'pulang pergi', '081295006209', '1985-06-06', '2019-04-25 18:23:28', '2019-04-25 18:23:28'),
(154, 'Alna Salsabila', NULL, '081317616292', 'Perempuan', 'Perumahan islami taman rahmani, cibitung', 'full 10 hari', '085216320553', '2000-04-13', '2019-04-25 20:08:46', '2019-04-25 20:08:46'),
(155, 'umum hikmah nurwahidah', NULL, '081290840267', 'Perempuan', 'batu jaya timur rt.001/006 kel.batu jaya kec.batuceper kab tangerang', 'full 10 hari', '085319553274', '2001-02-03', '2019-04-25 20:11:58', '2019-04-25 20:11:58'),
(159, 'Ragil Wahyudi', 'http://alikhlasdukuhbima.or.id/uploads/foto/1000047682_26-04-2019_06:04:59.jpg', '085702029693', 'Laki-Laki', 'Perumahan Taman aster Blok H1 No 44 Cikarang Barat', 'pulang pergi', '085742020089', '1993-08-14', '2019-04-25 23:06:59', '2019-04-25 23:06:59'),
(160, 'Dila harisah', NULL, '085697276994', 'Perempuan', 'Tangerang perum dasana indah', 'full 10 hari', '081317416538', '2000-03-11', '2019-04-26 02:17:16', '2019-04-26 02:17:16'),
(162, 'Del Ester', 'http://alikhlasdukuhbima.or.id/uploads/foto/635703771_26-04-2019_09:04:05.jpeg', '08127360751', 'Laki-Laki', 'Taman Setia Mekar Jl. Mawar Raya M4/27 Kel. Setia Mekar, Kec. Tambun Selatan, Kab. Bekasi', 'pulang pergi', '081223687823', '1964-06-07', '2019-04-26 02:50:05', '2019-04-26 02:50:05'),
(163, 'Yulliza marristya', NULL, '081298113006', 'Perempuan', 'Jl mandor demong rt 01 rw 03 no 106 17157', 'pulang pergi', '087882999974', '1990-07-10', '2019-04-26 06:26:14', '2019-04-26 06:26:14'),
(164, 'Muhammad andi hartono', 'http://alikhlasdukuhbima.or.id/uploads/foto/505618935_26-04-2019_13:04:50.jpg', '081319614141', 'Laki-Laki', 'perum papanmas 2 blok f10 no.10', 'pulang pergi', '081211670136', '1993-11-18', '2019-04-26 06:38:50', '2019-04-26 06:38:50'),
(165, 'Christiyadi', NULL, '08119590935', 'Laki-Laki', 'Papan Lintas Indah Blok i5 no.2 Mangunjaya Tambun Selatan', 'pulang pergi', '085691457301', '1978-12-25', '2019-04-26 06:41:45', '2019-04-26 06:41:45'),
(166, 'Dzaky Azhar', NULL, '08119590935', 'Laki-Laki', 'Papan Lintas Indah Blok i5 no.2 Mangunjaya Tambun Selatan', 'pulang pergi', '085691457301', '2006-03-14', '2019-04-26 06:43:28', '2019-04-26 06:43:28'),
(167, 'Achmad Adhy Gusman', NULL, '081288549484', 'Laki-Laki', 'Mutiara Gading Timur', 'full 10 hari', NULL, '1974-08-17', '2019-04-26 15:41:02', '2019-04-26 15:41:02'),
(168, 'Jamilah al fajry', NULL, '085893239862', 'Perempuan', 'Jln kali baru timur V gg. Puspa no 32rt 001 rw02 kec senen kel bangur jakpus', 'full 10 hari', '083876649974', '2003-11-20', '2019-04-26 16:06:14', '2019-04-26 16:06:14'),
(169, 'Toto suwanto', 'http://alikhlasdukuhbima.or.id/uploads/foto/170895198_27-04-2019_00:04:36.jpg', '085100673577', 'Laki-Laki', 'Perum pesona Pulo indah blok g 20 RT 04 Rw  53 Sumberjaya Tambun Selatan Bekasi', 'full 10 hari', '08568390916', '1961-11-28', '2019-04-26 17:20:37', '2019-04-26 17:20:37'),
(171, 'Anisah Imelda Fadhillah', NULL, '081384202809', 'Perempuan', 'jln hebras Gg jengkol rt/rw 02.06 no 172 jatimulya', 'full 10 hari', '081413015363', '2001-09-06', '2019-04-27 01:23:40', '2019-04-27 01:23:40'),
(172, 'Amelia Shafitri', NULL, '085764005191', 'Perempuan', 'jln hebras Gg jengkol rt/rw 02.06 no 172 jatimulya', 'full 10 hari', '081413015363', '2000-01-22', '2019-04-27 01:26:19', '2019-04-27 01:26:19'),
(173, 'Aulia Zahra Hasanah', NULL, '081384202809', 'Perempuan', 'jln hebras Gg jengkol rt/rw 02.06 no 172 jatimulya', 'full 10 hari', '081413015363', '2008-04-11', '2019-04-27 01:30:49', '2019-04-27 01:30:49'),
(174, 'Aisyah Zumikah Ramadhani', NULL, '081384202809', 'Perempuan', 'jln hebras Gg jengkol rt/rw 02.06 no 172 jatimulya', 'full 10 hari', '081413015363', '2005-10-07', '2019-04-27 01:32:21', '2019-04-27 01:32:21'),
(175, 'Sirajudin', NULL, '085283392770', 'Laki-Laki', 'jln hebras Gg jengkol rt/rw 02.06 no 172 jatimulya', 'pulang pergi', '089506452280', '1975-04-05', '2019-04-27 01:35:10', '2019-04-27 01:35:10'),
(176, 'Nurul Hidayati', NULL, '081381562696', 'Perempuan', 'Mangun Jaya Indah II, Jl. Camar IV Blok A. 13/9 Tambun Selatan', 'full 10 hari', '081313376069', '1982-05-08', '2019-04-27 03:33:12', '2019-04-27 03:33:12'),
(179, 'Hadi hartono', 'http://alikhlasdukuhbima.or.id/uploads/foto/167276533_27-04-2019_10:04:09.jpg', '081313376069', 'Laki-Laki', 'Mangun Jaya Indah II Jl. Camar IV Blok A.13/9 Tambun selatan 17510', 'full 10 hari', '081381562696', '1977-06-10', '2019-04-27 03:42:09', '2019-04-27 03:42:09'),
(180, 'Puji Dewi Astuti', NULL, '081315321177', 'Perempuan', 'Perum Graha Mustika Media Blok J7 no. 04', 'full 10 hari', '081315321177', '2000-10-30', '2019-04-27 04:37:30', '2019-04-27 04:37:30'),
(183, 'Nafisah Nurfitri', NULL, '087880626925', 'Perempuan', 'BTN Lambangsari Permai Blok B2 No.06 RT.01 RW.006 Tambun Selatan, Bekasi', 'full 10 hari', '081807397151', '2001-01-12', '2019-04-27 05:15:32', '2019-04-27 05:15:32'),
(184, 'Fathimah Az-zahra', NULL, '082123856913', 'Perempuan', 'Jalan Kusuma Selatan a blok e7 nomor 22 Perumahan Wisma Jaya', 'full 10 hari', '081224400736', '2002-12-12', '2019-04-27 05:44:13', '2019-04-27 05:44:13'),
(185, 'Maulidiah Siti Hajar', NULL, '083893927285', 'Perempuan', 'Jl.Toyogiri Selatan Gg. Masjid At Taufiq No.78 Rt/Rw 002/003 kel. Jatimulya kec. Tambun Selatan', 'full 10 hari', NULL, '1990-10-27', '2019-04-27 10:18:20', '2019-04-27 10:18:20'),
(186, 'Machdi Gemal', 'http://alikhlasdukuhbima.or.id/uploads/foto/589825708_27-04-2019_17:04:54.jpg', '081315523216', 'Laki-Laki', 'Jl.Toyogiri Selatan Gg. Masjid At Taufiq No.78 Rt/Rw 002/003 kel. Jatimulya kec. Tambun Selatan', 'full 10 hari', NULL, '1985-11-26', '2019-04-27 10:25:54', '2019-04-27 10:25:54'),
(187, 'Afif Azamroni', 'http://alikhlasdukuhbima.or.id/uploads/foto/777494444_27-04-2019_20:04:08.jpg', '08992013776', 'Laki-Laki', 'Perum Dukuh Bima JL.Bima Asri Utama No.25 Tambun', 'pulang pergi', '08128653154', '1978-02-05', '2019-04-27 13:05:08', '2019-04-27 13:05:08'),
(188, 'Abdulloh Faqih', 'http://alikhlasdukuhbima.or.id/uploads/foto/560775052_27-04-2019_20:04:17.jpg', '08992013776', 'Laki-Laki', 'Perum Dukuh Bima JL.Bima Asri Utama No.25 Tambun', 'full 10 hari', '08128653154', '2008-04-23', '2019-04-27 13:08:17', '2019-04-27 13:08:17'),
(189, 'Abdirrohman Faiz', 'http://alikhlasdukuhbima.or.id/uploads/foto/276724790_27-04-2019_20:04:53.jpg', '08992013776', 'Laki-Laki', 'Perum Dukuh Bima JL.Bima Asri Utama No.25 Tambun', 'full 10 hari', '08128653154', '2009-01-01', '2019-04-27 13:10:53', '2019-04-27 13:10:53'),
(190, 'Arvianto Wibowo', 'http://alikhlasdukuhbima.or.id/uploads/foto/890143719_27-04-2019_23:04:55.jpg', '081329455660', 'Laki-Laki', 'Perumahan Kompas Indah Estate (Kontrakan Baiti Jannati) B3/6D Jalan Keromes RT 01 RW 07 Kel. Mekarsari, Kacamatan Tambun Selatan, Kab. Bekasi,', 'pulang pergi', '08128116510', NULL, '2019-04-27 16:27:55', '2019-04-27 16:27:55'),
(191, 'Edah Azijah', NULL, '081239478042', 'Perempuan', 'Perumahan Kompas Indah Estate (Kontrakan Baiti Jannati) B3/6D Jalan Keromes RT 01 RW 07 Kel. Mekarsari, Kacamatan Tambun Selatan, Kab. Bekasi,', 'pulang pergi', '087774520860', '1991-06-09', '2019-04-27 16:32:52', '2019-04-27 16:32:52'),
(193, 'Nandan Triana Hudaya', 'http://alikhlasdukuhbima.or.id/uploads/foto/62003460_28-04-2019_00:04:06.jpg', '081311479286', 'Laki-Laki', 'Perumahan GMM, blok H. 11, no. 08,Rt.07,RW.10, Lubang Buaya, Setu, Bekasi', 'pulang pergi', '081311479287', '1981-03-15', '2019-04-27 17:19:06', '2019-04-27 17:19:06'),
(194, 'Muhammad Raisa Unais', 'http://alikhlasdukuhbima.or.id/uploads/foto/199622300_28-04-2019_00:04:55.jpg', '081311479286', 'Laki-Laki', 'Perumahan GMM, blok H. 11, no. 08,Rt.07,RW.10, Lubang Buaya, Setu, Bekasi', 'pulang pergi', '081311479287', '2009-01-01', '2019-04-27 17:21:55', '2019-04-27 17:21:55'),
(195, 'Ali Nurdin', NULL, '085882611308', 'Laki-Laki', 'Kp.legon rt 03 rw 04 jatimulya tambun selatan', 'pulang pergi', '081210004003', '1956-07-28', '2019-04-27 18:04:35', '2019-04-27 18:04:35'),
(196, 'Ahmad Mahfud', NULL, '081585848914', 'Laki-Laki', 'Perum kodam D15/2 mustikajaya bekasi', 'pulang pergi', '081519135110', '1975-03-11', '2019-04-27 18:17:55', '2019-04-27 18:17:55'),
(197, 'Alfa Shinta Nuraini', NULL, '081519135110', 'Perempuan', 'perum kodam d15/2 mustikajaya bekasi', 'full 10 hari', '081585848914', '1973-03-09', '2019-04-27 18:19:07', '2019-04-27 18:19:07'),
(198, 'Nadiya Fajriana Barda', NULL, '081519135110', 'Perempuan', 'perum kodam d15/2 mustikajaya bekasi', 'full 10 hari', '081585848914', '2001-09-20', '2019-04-27 18:21:34', '2019-04-27 18:21:34'),
(199, 'Syaifullah Faizul Akbar', NULL, '081585848914', 'Laki-Laki', 'perum kodam d15/2 mustikajaya bekasi', 'full 10 hari', '081519135110', '2005-12-24', '2019-04-27 18:22:41', '2019-04-27 18:22:41'),
(200, 'Fiizhila Caldri', NULL, '08811506451', 'Perempuan', 'Perum PDK blok A-15 rt 001 rw 07 desa Lambang Sari Tambun Selatan Bekasi', 'full 10 hari', '08988821879', '2002-08-10', '2019-04-28 02:06:07', '2019-04-28 02:06:07'),
(201, 'Wirdha Camila', NULL, '087875187616', 'Perempuan', 'Perum PDK blok A-15 rt 001 rw 07 desa Lambang Sari Tambun Selatan Bekasi', 'full 10 hari', '08988821879', '2001-04-03', '2019-04-28 02:08:13', '2019-04-28 02:08:13'),
(202, 'Maman Abdurachman', NULL, '08128650421', 'Laki-Laki', 'BTR Blok O7 no.72', 'pulang pergi', '081286360120', '2009-01-01', '2019-04-28 03:50:06', '2019-04-28 03:50:06'),
(203, 'Ahmad is Rokhim', NULL, '08979139079', 'Laki-Laki', 'wisma asri 02,  bekasi utara', 'full 10 hari', '088291793663', '1990-12-12', '2019-04-28 06:42:00', '2019-04-28 06:42:00'),
(204, 'Ricky Fitrah Abhari', 'http://alikhlasdukuhbima.or.id/uploads/foto/129421197_28-04-2019_14:04:12.jpg', '082258127027', 'Laki-Laki', 'Jalan harmonika vila mutiara gading blok h1 no 34 rt 4 rt 15 tarumajaya setia asih, bekasi utara', 'pulang pergi', '082258127027', '1994-03-10', '2019-04-28 07:13:12', '2019-04-28 07:13:12'),
(205, 'Miftakhul Jannah Oktavia', NULL, '081413015363', 'Perempuan', 'jln hebras Gg jengkol rt/rw 02.06 no 172 jatimulya', 'full 10 hari', '081413015363', '2007-10-19', '2019-04-28 07:28:35', '2019-04-28 07:28:35'),
(206, 'Emiwarti', NULL, '081398348986', 'Perempuan', 'Margahayu jaya blok b 277', 'full 10 hari', '081290815908', '1965-08-03', '2019-04-28 18:30:47', '2019-04-28 18:30:47'),
(207, 'Wasa abu mubarok', NULL, '085692221694', 'Laki-Laki', 'Pesona bumyagara blok f12/1. Mutiara gading timur', 'pulang pergi', '082124381930', NULL, '2019-04-29 05:57:52', '2019-04-29 05:57:52'),
(209, 'ARFAN KHALIMY PUTRA', 'http://alikhlasdukuhbima.or.id/uploads/foto/256525305_29-04-2019_23:04:55.jpg', '082112768376', 'Laki-Laki', 'Bekasi', 'full 10 hari', '6285781355744', '1996-08-23', '2019-04-29 16:09:55', '2019-04-29 16:09:55'),
(210, 'Ade Triananda Prabowo', NULL, '085219609412', 'Perempuan', 'Jl. Lumbu Utara Raya VI E no.14 Rt.4/Rw.31 Rawalumbu, Bekasi 17116', 'pulang pergi', '081286261786', '2008-11-14', '2019-04-29 16:38:07', '2019-04-29 16:38:07'),
(211, 'Dika Rizki Saptama', NULL, '082260690232', 'Laki-Laki', 'Jl. Lumbu Utara Raya VI E no.14 Rt.4/Rw.31 Rawalumbu, Bekasi 17116', 'pulang pergi', '081286261786', '2008-07-18', '2019-04-29 16:40:49', '2019-04-29 16:40:49'),
(212, 'Imro\'atus Sholihah', NULL, '085288008560', 'Perempuan', 'Perumahan Telaga Harapan Blok C 19/46, Cikarang Barat, Bekasi.', 'full 10 hari', '08161307515', '1975-04-12', '2019-04-29 19:01:52', '2019-04-29 19:01:52'),
(213, 'Salma Faizatun Nuha', NULL, '085212166276', 'Perempuan', 'Perumahan Telaga Harapan Blok C 19/46, Cikarang Barat, Bekasi.', 'full 10 hari', '08161307515', '2001-12-11', '2019-04-29 19:05:50', '2019-04-29 19:05:50'),
(214, 'Fawwaz Anwarul Huda', NULL, '085213253054', 'Laki-Laki', 'Perumahan Telaga Harapan Blok C 19/46, Cikarang Barat, Bekasi.', 'full 10 hari', '08161307515', '2005-06-07', '2019-04-29 19:10:30', '2019-04-29 19:10:30'),
(215, 'Agus Bijanto', NULL, '081290639620', 'Laki-Laki', 'Perumahan Telaga Harapan Blok C 19/46, Cikarang Barat, Bekasi.', 'full 10 hari', '085288008560', '1972-08-06', '2019-04-29 19:13:23', '2019-04-29 19:13:23'),
(216, 'Nisrina Hasna', NULL, '0895355274616', 'Perempuan', 'Perum. Papan Mas Bloh G 43 no. 11, Jl. Mas Indah 18, Tambun Selatan, Kab. Bekasi, Jawa Barat', 'pulang pergi', '0895355274616', '1999-09-14', '2019-04-29 23:11:34', '2019-04-29 23:11:34'),
(217, 'Annisa Salsabilla', NULL, '083807630023', 'Perempuan', 'Perumahan PU Sapta Taruna IV Blok E No.142 kelurahan Sumur Batu, Kecamatan Bantargebang. Bekasi Timur', 'pulang pergi', '085959663442', '1999-05-06', '2019-04-29 23:53:01', '2019-04-29 23:53:01'),
(218, 'Berliana Putri Usman', NULL, '083897436643', 'Perempuan', 'Indoporlen, Tambun Selatan, Bekasi Timur', 'pulang pergi', '083893259494', '1999-08-27', '2019-04-30 00:03:37', '2019-04-30 00:03:37'),
(219, 'Ashana Abdillah', NULL, '082110982565', 'Perempuan', 'Jalan pangkalan 2 rt 02 rw 02 cikiwul, bantargebang, bekasi timur', 'pulang pergi', '6289658938810', '1999-07-10', '2019-04-30 05:02:16', '2019-04-30 05:02:16'),
(220, 'Muhammad Haidar Hafizh', 'http://alikhlasdukuhbima.or.id/uploads/foto/104430104_30-04-2019_12:04:16.jpg', '081398876148', 'Laki-Laki', 'Cikarang', 'pulang pergi', '085218541835', '2000-07-24', '2019-04-30 05:36:16', '2019-04-30 05:36:16'),
(221, 'Dila harisa', NULL, '085697276994', 'Perempuan', 'Perumnas 1 tangerang. Jl bango 3 no 69.cibodasari.cibodas.', 'full 10 hari', '081317416538', '2000-03-11', '2019-04-30 07:14:41', '2019-04-30 07:14:41'),
(222, 'Muhammad Haidar Hafizh', 'http://alikhlasdukuhbima.or.id/uploads/foto/730546852_30-04-2019_15:04:14.jpg', '081398', 'Laki-Laki', 'Cikarang', 'full 10 hari', '085218541835', '2000-07-24', '2019-04-30 08:21:14', '2019-04-30 08:21:14'),
(223, 'Sugeng riyadhi', 'http://alikhlasdukuhbima.or.id/uploads/foto/313097847_01-05-2019_12:05:39.jpg', '08981432175', 'Laki-Laki', 'Summarecon', 'full 10 hari', '085218541835', '1998-01-04', '2019-05-01 05:30:40', '2019-05-01 05:30:40'),
(224, 'Oktiansyah', 'http://alikhlasdukuhbima.or.id/uploads/foto/343676070_01-05-2019_12:05:46.jpg', '085930270524', 'Laki-Laki', 'Jl. Melur 1 Blok F37 No. 13', 'pulang pergi', '081806962823', '1988-10-13', '2019-05-01 05:39:47', '2019-05-01 05:39:47'),
(225, 'Wahid Kurniawan', 'http://alikhlasdukuhbima.or.id/uploads/foto/730757657_01-05-2019_12:05:01.jpg', '08111770700', 'Laki-Laki', 'Perum. Bumi Bekasi Baru Jl. Batu Giok II No.65 RT.002/037 Rawalumbu, Kota Bekasi, Jawa Barat 17116', 'full 10 hari', '082122709001', '1978-05-24', '2019-05-01 05:44:01', '2019-05-01 05:44:01'),
(226, 'Aisyah nur fauziyyah', NULL, '081383128143', 'Perempuan', 'Perumahan ziara valley, cluster kencana blok L no 8, dramaga, bogor', 'pulang pergi', '089647740019', '1999-09-23', '2019-05-01 07:44:43', '2019-05-01 07:44:43'),
(227, 'Bayu pramana putra', 'https://alikhlasdukuhbima.or.id/uploads/foto/7667022_01-05-2019_14:05:05.jpg', '089647740019', 'Laki-Laki', 'Perumahan ziara valley, cluster kencana blok L no 8, dramaga, bogor', 'full 10 hari', '081383128143', '1992-07-21', '2019-05-01 07:49:05', '2019-05-01 07:49:05'),
(228, 'Muhamad Amirga', 'http://alikhlasdukuhbima.or.id/uploads/foto/160796060_01-05-2019_14:05:59.jpeg', '08126111916', 'Laki-Laki', 'KP Selang Cau RT005/013 Wanasari Cibitung, Bekasi', 'pulang pergi', '081316666967', '1999-10-14', '2019-05-01 07:53:59', '2019-05-01 07:53:59'),
(229, 'muhamad dede daerobi', 'http://alikhlasdukuhbima.or.id/uploads/foto/856090984_01-05-2019_17:05:51.jpg', '085888361361', 'Laki-Laki', 'kp.ceger ds.sukajaya kab.cibitung kab bekasi rt002/rw003', 'full 10 hari', '6285888803056', '1989-11-08', '2019-05-01 10:23:51', '2019-05-01 10:23:51'),
(230, 'bilal fachrurizal', NULL, '085227307658', 'Laki-Laki', 'Perum Dukuh Zamrud Blok P', 'full 10 hari', '081288252433', NULL, '2019-05-01 16:13:59', '2019-05-01 16:13:59'),
(231, 'Fauzan farhan iskandar', 'http://alikhlasdukuhbima.or.id/uploads/foto/813653815_02-05-2019_01:05:23.jpg', '0895379141577', 'Laki-Laki', 'Dukuh Zamrud Blok I 29/16 RT.01 RW.012, Kel. Cimuning, Kec. Mustika Jaya, Bekasi', 'full 10 hari', '081284069797', '2000-08-28', '2019-05-01 18:01:23', '2019-05-01 18:01:23'),
(232, 'Fariz Setiawan', 'http://alikhlasdukuhbima.or.id/uploads/foto/226427950_02-05-2019_04:05:10.jpg', '089658811162', 'Laki-Laki', 'Jl. Pangeran Jayakarta RT 003 RW 04 No.38. Bekasi Barat', 'pulang pergi', '085718312431', '1992-07-12', '2019-05-01 21:02:10', '2019-05-01 21:02:10'),
(233, 'Anindita Rahmadanti Firdausa', NULL, '085718312431', 'Perempuan', 'Jl. Wareng Kalijambe RT 003 RW 04 No 48 Lambangsari, Tambun Selatan, Bekasi', 'full 10 hari', '089658811162', '1993-02-06', '2019-05-01 21:09:43', '2019-05-01 21:09:43'),
(234, 'Sigit Budianto', NULL, '0811193687', 'Laki-Laki', 'Perum Grand Wisata Cluster Spring Fiesta Blok AK5 no 17 Tambun Selatan Bekasi', 'pulang pergi', '08170804876', '1975-06-23', '2019-05-01 21:31:03', '2019-05-01 21:31:03'),
(235, 'dian kurniasari', NULL, '081380805455', 'Perempuan', 'jl.An nur II rt 11 rw 12 no. 31 kayuringin jaya bekasi selatan', 'pulang pergi', '081310944147', '1975-12-10', '2019-05-01 21:43:24', '2019-05-01 21:43:24'),
(236, 'Nurul Hanifah', NULL, '082387512211', 'Perempuan', 'Perumahan Dukuh Zamrud Blok E no 23/17, Cimuning, Mustika Jaya, Bekasi', 'full 10 hari', '081374833997', '1994-08-21', '2019-05-01 21:54:35', '2019-05-01 21:54:35'),
(237, 'chairiyah puteri dinanti', NULL, '08889314660', 'Perempuan', 'Wisma jaya jl kusuma barat XI blok XI no 11 RT 13 RW 17 kel. Durenjaya kec. Bekasi timur', 'full 10 hari', '081382001917', '1997-05-16', '2019-05-01 22:00:28', '2019-05-01 22:00:28'),
(238, 'Hendra Mulyawan', 'http://alikhlasdukuhbima.or.id/uploads/foto/671563318_02-05-2019_05:05:21.jpg', '081310944147', 'Laki-Laki', 'jl.An nur II rt 11 rw 12 no. 31 kayuringin jaya bekasi selatan', 'pulang pergi', '081380805455', '1980-10-09', '2019-05-01 22:18:21', '2019-05-01 22:18:21'),
(239, 'ibrahim athallah yasfin', 'http://alikhlasdukuhbima.or.id/uploads/foto/307511073_02-05-2019_05:05:43.jpg', '081284238384', 'Laki-Laki', 'jl.An nur II rt 11 rw 12 no. 31 kayuringin jaya bekasi selatan', 'pulang pergi', '081310944147', '2006-03-19', '2019-05-01 22:21:43', '2019-05-01 22:21:43'),
(240, 'aisyah iqlil huwaida', NULL, '085215674299', 'Perempuan', 'jl.An nur II rt 11 rw 12 no. 31 kayuringin jaya bekasi selatan', 'pulang pergi', '081310944147', '2006-11-27', '2019-05-01 22:23:02', '2019-05-01 22:23:02'),
(241, 'Arief fahrurhazhi', 'http://alikhlasdukuhbima.or.id/uploads/foto/383208362_02-05-2019_05:05:20.png', '082208283321', 'Laki-Laki', 'Perum. Bekasi griya pratama blok c3 no.14 tambun selatan. Bekasi', 'pulang pergi', '085775572951', '1985-08-08', '2019-05-01 22:26:20', '2019-05-01 22:26:20'),
(242, 'Dzaky Abdillah Majid', 'http://alikhlasdukuhbima.or.id/uploads/foto/951968399_02-05-2019_05:05:11.jpeg', '085880299256', 'Laki-Laki', 'Taman Bumyagara Blok F1 No. 8C Mustikajaya Kota Bekasi', 'full 10 hari', '081283524632', '2002-01-22', '2019-05-01 22:35:11', '2019-05-01 22:35:11'),
(243, 'Alfandias Seysna Putra', 'http://alikhlasdukuhbima.or.id/uploads/foto/39071603_02-05-2019_05:05:14.jpg', '081219094901', 'Laki-Laki', 'Jl Trembesi C19 No 15, Kompas Indah, RT 01 RW 08, Desa Mekarsari, Kec Tambun Selatan, Kab Bekasi', 'pulang pergi', '08111638594', '1994-12-26', '2019-05-01 22:43:14', '2019-05-01 22:43:14'),
(244, 'Iwan Zaied Hady', 'http://alikhlasdukuhbima.or.id/uploads/foto/80022085_02-05-2019_05:05:13.jpg', '085737021306', 'Laki-Laki', 'jl.cemara ujung ruko blok C 2 koja baru Jakarta Utara', 'pulang pergi', '0895379141577', '1994-05-15', '2019-05-01 22:53:13', '2019-05-01 22:53:13'),
(245, 'Heru', 'http://alikhlasdukuhbima.or.id/uploads/foto/997124080_02-05-2019_06:05:47.jpg', '089685546848', 'Laki-Laki', 'Desa mekar mukti rt 02 rw 06 cikarang utara', 'pulang pergi', '081382602410', '1992-11-10', '2019-05-01 23:02:48', '2019-05-01 23:02:48'),
(246, 'Muhamad amin', NULL, '081383216744', 'Laki-Laki', 'Jl. Magelang D.1 no. 15 kemang ifi jatirasa Bekasi Kota', 'pulang pergi', '08170786632', NULL, '2019-05-01 23:13:10', '2019-05-01 23:13:10'),
(247, 'Guruh', 'http://alikhlasdukuhbima.or.id/uploads/foto/193874426_02-05-2019_06:05:30.jpg', '08999790990', 'Laki-Laki', 'Perum Cahaya Darussalam Kec. Setu Kab. Bekasi ( Samping Perum Grand Residence )', 'pulang pergi', '0898120039', '1989-10-28', '2019-05-01 23:28:30', '2019-05-01 23:28:30'),
(248, 'Ahmad Nasrul', 'http://alikhlasdukuhbima.or.id/uploads/foto/72589128_02-05-2019_06:05:41.jpg', '0896540899970', 'Laki-Laki', 'Grand Residence City Cluster Prapanca 1 BD 16/22', 'pulang pergi', '081380719714', '1982-01-03', '2019-05-01 23:30:43', '2019-05-01 23:30:43'),
(249, 'Agus Darmono', 'http://alikhlasdukuhbima.or.id/uploads/foto/845983280_02-05-2019_06:05:52.jpg', '08118002091', 'Laki-Laki', 'Dukuh Zamrud S8/34', 'pulang pergi', '08128126049', '1965-08-16', '2019-05-01 23:32:52', '2019-05-01 23:32:52'),
(250, 'Sandy', 'http://alikhlasdukuhbima.or.id/uploads/foto/494737256_02-05-2019_06:05:41.png', '0811633394', 'Laki-Laki', 'Jl pinus 3 no 2A perumahan meadow green lippo cikarang', 'pulang pergi', '085261579137', '1994-07-18', '2019-05-01 23:33:42', '2019-05-01 23:33:42'),
(251, 'Endah Lastiany', NULL, '08128126049', 'Perempuan', 'Dukuh Zamrud blok S8 no 34', 'pulang pergi', '08118002091', '1971-03-07', '2019-05-01 23:35:13', '2019-05-01 23:35:13'),
(252, 'Arif rahman', NULL, '081289156667', 'Laki-Laki', 'Jln. Garuda 4 No:303 Jatimulya Bekasi Timur', 'full 10 hari', '087879335671', '1981-04-04', '2019-05-01 23:43:28', '2019-05-01 23:43:28'),
(253, 'Mahmud arief nasuha', NULL, '082146237741', 'Laki-Laki', 'Perumahan dukuh zambrud blom n1 no 6', 'full 10 hari', '081283612356', '1998-07-04', '2019-05-01 23:47:01', '2019-05-01 23:47:01'),
(254, 'Wafi Izzudien', 'http://alikhlasdukuhbima.or.id/uploads/foto/9405758_02-05-2019_06:05:23.jpg', '081340206186', 'Laki-Laki', 'Perum inkoppol blok w no.8 Tambun Selatan Kab. Bekasi', 'pulang pergi', '085213238377', '1994-11-04', '2019-05-01 23:50:24', '2019-05-01 23:50:24'),
(255, 'Fathimah az zahrah', NULL, '08568019776', 'Perempuan', 'Jln.irian jayaraya blok 8 no.17 perum3bekasi timur', 'full 10 hari', '085215828023', '2005-04-29', '2019-05-01 23:51:38', '2019-05-01 23:51:38');
INSERT INTO `jamaah` (`id`, `name`, `image`, `tlpn`, `jenis_kelamin`, `alamat`, `kategori`, `tlpn_saudara`, `tgl_lahir`, `created_at`, `updated_at`) VALUES
(256, 'Nurfadhilah', NULL, '08568019776', 'Laki-Laki', 'Jln.irian jaya raya blok 8no.17 perum 3 bekasi timur', 'full 10 hari', '085215828023', '2002-05-24', '2019-05-01 23:54:22', '2019-05-01 23:54:22'),
(257, 'Januar', NULL, '085215828023', 'Laki-Laki', 'Jln.irian jaya raya blok 8 no.17 perum 3 bekasi timur', 'full 10 hari', '08568019776', '1965-01-26', '2019-05-01 23:58:31', '2019-05-01 23:58:31'),
(258, 'Muhamad Riza Wardana', 'http://alikhlasdukuhbima.or.id/uploads/foto/677307655_02-05-2019_07:05:29.jpeg', '081280022321', 'Laki-Laki', 'Jalan kecapi 5 perumahan Jatimulya Bekasi Timur', 'pulang pergi', '087788140419', '1991-09-20', '2019-05-02 00:02:29', '2019-05-02 00:02:29'),
(259, 'Diva tripia lianna', 'http://alikhlasdukuhbima.or.id/uploads/foto/234982200_02-05-2019_07:05:09.jpg', '087882999974', 'Perempuan', 'Ciketing benda rt. 03 rw. 03', 'pulang pergi', '082260394123', '1994-08-15', '2019-05-02 00:03:09', '2019-05-02 00:03:09'),
(260, 'Basu Swasta S', 'http://alikhlasdukuhbima.or.id/uploads/foto/351785190_02-05-2019_07:05:02.jpg', '081287288814', 'Laki-Laki', 'Bekasi Timur Regensi 5 Cluster Hibiscus H9 no 12, sumur batu, bantar gebang', 'pulang pergi', '08128580259', '1988-03-14', '2019-05-02 00:06:02', '2019-05-02 00:06:02'),
(261, 'Andy Saifullah', NULL, '081291635701', 'Laki-Laki', 'Jl jalak Bali 1 no.26 Bekasi Timur Regensi', 'full 10 hari', '081289577417', '2009-01-01', '2019-05-02 00:07:09', '2019-05-02 00:07:09'),
(262, 'andy saifullah', NULL, '082120914805', 'Laki-Laki', 'jl jalak bali 1 no.26 perumahan bekasi timur regensi', 'full 10 hari', '081289577417', '1980-07-06', '2019-05-02 00:16:57', '2019-05-02 00:16:57'),
(263, 'Apriadi Siregar', 'http://alikhlasdukuhbima.or.id/uploads/foto/631439424_02-05-2019_07:05:34.jpeg', '082213497419', 'Laki-Laki', 'Komplek PU Sapta Taruna 4 Blok G no.21 Kel. Sumur Batu Kec. Bantar Gebang Kota Bekasi', 'pulang pergi', '081319598529', '1994-06-16', '2019-05-02 00:19:35', '2019-05-02 00:19:35'),
(264, 'Nurholish majid', NULL, '085691898116', 'Laki-Laki', 'Perum wisma jaya Jl.Kusuma barat blok DD3/2 rt 06/18 bekasi timur', 'pulang pergi', NULL, '1968-05-21', '2019-05-02 00:45:36', '2019-05-02 00:45:36'),
(265, 'Septiyadi bangun', NULL, '081218683637', 'Laki-Laki', 'Mutiara gading timur blok B1 no 12', 'pulang pergi', '081770824692', '1990-09-06', '2019-05-02 00:50:50', '2019-05-02 00:50:50'),
(266, 'Kemas Andana Pratama', 'https://alikhlasdukuhbima.or.id/uploads/foto/403773643_02-05-2019_08:05:31.jpg', '087808874028', 'Laki-Laki', 'Jl.bulus 1 cluster no 6 taman galaxy ,jaka setia, bekasi selatan', 'full 10 hari', '087786352576', '1987-06-29', '2019-05-02 01:15:31', '2019-05-02 01:15:31'),
(267, 'Evi Hasibuan', NULL, '08811235346', 'Perempuan', 'Perum Trias blok H2-03 Cibitung', 'full 10 hari', '081381280898', '1967-11-15', '2019-05-02 01:19:32', '2019-05-02 01:19:32'),
(268, 'Deril saputra', 'http://alikhlasdukuhbima.or.id/uploads/foto/681901359_02-05-2019_08:05:39.jpg', '082175289089', 'Laki-Laki', 'Jln.benda gg.masjid assurul,padurenan mistikqjaya bantargebang', 'pulang pergi', NULL, '1994-12-07', '2019-05-02 01:20:40', '2019-05-02 01:20:40'),
(269, 'Doni anggara', NULL, '081381556322', 'Laki-Laki', 'Bekasi timur', 'pulang pergi', '081381556322', '2000-08-07', '2019-05-02 01:24:35', '2019-05-02 01:24:35'),
(271, 'Rizky Apriyanto', 'http://alikhlasdukuhbima.or.id/uploads/foto/910151426_02-05-2019_09:05:49.jpg', '089658985650', 'Laki-Laki', 'Perumahan Griya asri bahagia rt 008/033 G13 No 9 , Kelurahan Bahagia Kecamatan babelan kabupaten bekasi , 17610', 'pulang pergi', '081290229050', '1999-04-14', '2019-05-02 02:35:50', '2019-05-02 02:35:50'),
(272, 'Fahri Ramadhan', 'http://alikhlasdukuhbima.or.id/uploads/foto/804658899_02-05-2019_09:05:40.jpg', '085972873823', 'Laki-Laki', 'margahayu jaya, Blok d, no. 527. Bekasi Timur', 'pulang pergi', '085972873823', '1998-01-22', '2019-05-02 02:36:40', '2019-05-02 02:36:40'),
(273, 'Nia dwi jayanti', NULL, '089617444141', 'Perempuan', 'Grand residance city cluster North antasari db 07 no 11 desa burangkeng setu bekasi timur', 'pulang pergi', '089636954693', '1994-01-03', '2019-05-02 02:36:45', '2019-05-02 02:36:45'),
(274, 'Farhan Abdillah Chandra', NULL, '085693170702', 'Laki-Laki', 'Perum Pondok Timur Indah 1 Jl.Panda 1 Blok D No.45 RT.007 RW.016 Kel.Jatimulya Kec.Tambun Selatan', 'full 10 hari', '081286478443', '2003-10-15', '2019-05-02 02:37:48', '2019-05-02 02:37:48'),
(275, 'Iqbal Adam', 'https://alikhlasdukuhbima.or.id/uploads/foto/289353969_02-05-2019_09:05:41.jpg', '085882112406', 'Laki-Laki', 'Jl. Inspeksi Drain Cakung Cakung Barat Jakarta Timur', 'full 10 hari', '0816104073', '1999-03-26', '2019-05-02 02:38:41', '2019-05-02 02:38:41'),
(276, 'Dimas Ardiansyah', NULL, '081285727936', 'Laki-Laki', 'Perumahan Pesona bumyagara blog F 17 no 24 Rt 023/03', 'full 10 hari', '082111511719', '2003-07-07', '2019-05-02 02:41:24', '2019-05-02 02:41:24'),
(277, 'Innayah', NULL, '083139373384', 'Perempuan', 'Kp.rawa kalong rt 02/05 bekasi', 'full 10 hari', '08990501211', '2005-03-18', '2019-05-02 03:19:21', '2019-05-02 03:19:21'),
(278, 'Tatis sisri', NULL, '082253038420', 'Perempuan', 'Kp.lw malang ds sukaresmi cikarang selatan', 'pulang pergi', '08111100822', '1994-02-20', '2019-05-02 03:33:54', '2019-05-02 03:33:54'),
(279, 'Hendra febriansyah', NULL, '089637918497', 'Laki-Laki', 'Kp.jati rt.02 rw.08 desa jatimulya kecamatan tambun selatan kabupaten bekasi', 'pulang pergi', '088225961061', '1990-02-14', '2019-05-02 03:35:17', '2019-05-02 03:35:17'),
(280, 'Agus Hambali', NULL, '08111100822', 'Laki-Laki', 'Kp.lw malang des.sukaresmi cikarang selatan', 'pulang pergi', '082253038420', '1988-08-17', '2019-05-02 03:45:34', '2019-05-02 03:45:34'),
(281, 'Marthadinata devy novianto', NULL, '081297899666', 'Laki-Laki', 'Perum Margahayu Jaya , jl.margahayu raya blok D no. 10', 'pulang pergi', '08568989784', '1984-11-09', '2019-05-02 04:18:35', '2019-05-02 04:18:35'),
(282, 'Sidik Nur Rohman', 'http://alikhlasdukuhbima.or.id/uploads/foto/90203503_02-05-2019_11:05:21.jpg', '085280353028', 'Laki-Laki', 'Kontrakan bapak Agus kp kampung kongsi Cikarang Utara Bekasi', 'pulang pergi', '082323927198', '1994-09-12', '2019-05-02 04:47:21', '2019-05-02 04:47:21'),
(283, 'Alfinia Firrizqi', NULL, '081211151995', 'Perempuan', 'Jalan Pembina Raya no. 231 RT 05/04 blok II Bumi Bekasi Baru, Jembatan 1 Rawalumbu - Bekasi Timur 17115', 'full 10 hari', '0878760668', '1995-05-01', '2019-05-02 04:57:19', '2019-05-02 04:57:19'),
(284, 'Abdul rachman', 'http://alikhlasdukuhbima.or.id/uploads/foto/27622993_02-05-2019_12:05:53.jpg', '085694130401', 'Laki-Laki', 'Jln raya citarik ds jatireja kp binong cikarang timur', 'pulang pergi', '085813873791', '1994-06-07', '2019-05-02 05:58:54', '2019-05-02 05:58:54'),
(285, 'Muhamad Syakjb Dawud', NULL, '085217320512', 'Laki-Laki', 'Puri Cendana Blok krakatau D16', 'pulang pergi', NULL, '1975-08-22', '2019-05-02 05:59:35', '2019-05-02 05:59:35'),
(286, 'Angellina putri', NULL, '081385867550', 'Perempuan', 'Jln raya citarik kl binong ds jatiredja cikarang timur', 'full 10 hari', '085694130401', '1994-08-31', '2019-05-02 06:02:21', '2019-05-02 06:02:21'),
(287, 'M. Suryadi', NULL, '0811933801', 'Laki-Laki', 'Perumahan Grand Wisata Blok AK 09 No. 20 Tambun - Bekasi', 'full 10 hari', '081385840568', '1968-04-11', '2019-05-02 06:08:32', '2019-05-02 06:08:32'),
(288, 'Arief Rachman', 'http://alikhlasdukuhbima.or.id/uploads/foto/245931561_02-05-2019_14:05:54.jpeg', '081214121314', 'Laki-Laki', 'Cempedak IX No 302 Jatimulya', 'pulang pergi', '081394394964', '1985-02-09', '2019-05-02 07:19:55', '2019-05-02 07:19:55'),
(289, 'Yusuf', 'http://alikhlasdukuhbima.or.id/uploads/foto/482687872_02-05-2019_14:05:59.jpeg', '087733951312', 'Laki-Laki', 'Jl. Papan mas, blok f4 no 26, setiamekar, tambun', 'full 10 hari', NULL, '2000-02-21', '2019-05-02 07:29:00', '2019-05-02 07:29:00'),
(290, 'Wiro muhammad', 'http://alikhlasdukuhbima.or.id/uploads/foto/613202111_02-05-2019_14:05:14.jpg', '082126089505', 'Laki-Laki', 'Kp.cibuntu rt 003 rw 005 kec cibitung', 'full 10 hari', '082188772946', '2000-10-22', '2019-05-02 07:30:14', '2019-05-02 07:30:14'),
(291, 'Mahmud Yunus', NULL, '082312841980', 'Laki-Laki', 'Metland Tambun Jl. Kalimaya VI Blok L1 No 23b', 'pulang pergi', '082246504554', '1979-02-07', '2019-05-02 07:36:58', '2019-05-02 07:36:58'),
(292, 'Yusuf maulana', NULL, '089602899087', 'Laki-Laki', 'Cimuning mustika jaya', 'pulang pergi', '089602899087', '2009-01-01', '2019-05-02 07:40:26', '2019-05-02 07:40:26'),
(293, 'Mohammad farid rajab', 'http://alikhlasdukuhbima.or.id/uploads/foto/986619109_02-05-2019_15:05:09.jpg', '08159875605', 'Laki-Laki', 'Dukuh zamrud', 'full 10 hari', '081362044555', '1984-04-05', '2019-05-02 08:20:10', '2019-05-02 08:20:10'),
(294, 'Diyanissa', NULL, '085641039575', 'Perempuan', 'Jl.  Raya rawa semut no 23, Margahayu,  Bekasi Timur', 'pulang pergi', '081326299005', '1997-08-04', '2019-05-02 08:30:28', '2019-05-02 08:30:28'),
(295, 'Korina mulya', NULL, '081294418280', 'Perempuan', 'Mutiara gading timur blok L3/18', 'pulang pergi', '081288549484', '1977-08-08', '2019-05-02 09:08:18', '2019-05-02 09:08:18'),
(296, 'Islaachul Umaam', 'http://alikhlasdukuhbima.or.id/uploads/foto/32384711_02-05-2019_17:05:30.jpg', '087764361561', 'Laki-Laki', 'Cibiting', 'pulang pergi', '088809613901', '1994-02-22', '2019-05-02 10:07:31', '2019-05-02 10:07:31'),
(297, 'Sugeng bagyo', NULL, '081287103614', 'Laki-Laki', 'Mutiara gading timur blok s12/40 Mustika Jaya', 'pulang pergi', '081282473547', '1975-05-22', '2019-05-02 12:21:01', '2019-05-02 12:21:01'),
(298, 'Abdillah Fauzan', NULL, '081282473547', 'Laki-Laki', 'Mutiara gading timur blok S12/40', 'full 10 hari', '081287103614', '2005-03-11', '2019-05-02 12:21:01', '2019-05-02 12:21:01'),
(299, 'Abdillah Fauzan', NULL, '081282473547', 'Laki-Laki', 'Mutiara gading timur blok S12/40', 'full 10 hari', '081287103614', '2005-03-11', '2019-05-02 12:21:01', '2019-05-02 12:21:01'),
(300, 'Irawan', NULL, '087884342464', 'Laki-Laki', 'Jl cendana 2 blok i no 544 Rt 04/011 Jatimulya bekasi 17510', 'pulang pergi', '087879460910', '1964-08-03', '2019-05-02 16:41:44', '2019-05-02 16:41:44'),
(301, 'Evry yani', NULL, '083842435163', 'Perempuan', 'Kelapa dua Rt.03/09 Kel.padurenan Kec.Mustikajaya', 'pulang pergi', '089529201541', '1984-03-09', '2019-05-02 19:36:02', '2019-05-02 19:36:02'),
(302, 'Kesya putri', NULL, '083842435163', 'Perempuan', 'Kelapa dua Rt.03/09 Kel.padurenan Kec.Mustikajaya', 'pulang pergi', '089529201541', '2007-01-30', '2019-05-02 19:37:43', '2019-05-02 19:37:43'),
(303, 'Sarah ummu heri', NULL, '0895324601083', 'Perempuan', 'Kmp kelapa dua rt 03 / 09 mustika jaya', 'full 10 hari', '089529201541', NULL, '2019-05-02 19:42:57', '2019-05-02 19:42:57'),
(304, 'Endah Jubaedah', NULL, '085891556972', 'Perempuan', 'jl perum dukuh zamrud Blok N 07 No 06', 'full 10 hari', '082122937259', '1983-01-05', '2019-05-02 19:51:24', '2019-05-02 19:51:24'),
(305, 'khuril nur sa\'adatul kamaliah', NULL, '085891556972', 'Perempuan', 'jl perum Dukuh Zamrud Blok N 07 no 06', 'full 10 hari', '082122937259', '2000-10-01', '2019-05-02 19:54:02', '2019-05-02 19:54:02'),
(306, 'Kasino', NULL, '082122937259', 'Laki-Laki', 'jl perum Dukuh Zamrud Blok N 07 no 06', 'full 10 hari', '082122937259', '1960-02-12', '2019-05-02 19:56:21', '2019-05-02 19:56:21'),
(307, 'Alkhairy nur rayhan', NULL, '082122937259', 'Laki-Laki', 'jl perum Dukuh Zamrud Blok N 07 no 06', 'full 10 hari', '082122937259', '2006-08-30', '2019-05-02 19:58:11', '2019-05-02 19:58:11'),
(308, 'ridwan', 'http://alikhlasdukuhbima.or.id/uploads/foto/820413669_03-05-2019_03:05:31.jpg', '085216520370', 'Laki-Laki', 'perum unggul graha permai tambun', 'full 10 hari', '081386818679', NULL, '2019-05-02 20:24:31', '2019-05-02 20:24:31'),
(309, 'rahmadiana', NULL, '081386818679', 'Perempuan', 'perum unggul graha permai tambun', 'full 10 hari', '085216520370', NULL, '2019-05-02 20:28:22', '2019-05-02 20:28:22'),
(310, 'siti romlah', NULL, '081383949395', 'Perempuan', 'taman tridaya indah 2 blok  i 14 / 22 rt 03 rw 15 tridayasakti Tambun selatan', 'full 10 hari', '082229990459', NULL, '2019-05-02 22:46:57', '2019-05-02 22:46:57'),
(311, 'David', NULL, '08128785985', 'Laki-Laki', 'Royal Platinum Residence Blok C no.1, Jl. H. Umar, kp. Ciketing, RT.001/RW.09, mustika jaya, Kota Bekaai', 'pulang pergi', '081314051027', '1977-01-27', '2019-05-02 22:49:53', '2019-05-02 22:49:53'),
(312, 'Fina Nurul Faizah', NULL, '081312110542', 'Perempuan', 'Perum koperindag blok H no 4', 'full 10 hari', '081312110542', '1995-06-27', '2019-05-02 23:21:12', '2019-05-02 23:21:12'),
(313, 'Annisa Aulia Syarif', NULL, '085738630851', 'Perempuan', 'Jl. Jembar, No. 28 RT/RW 02/010 kel. Jatimulya, kec. Tambun Selatan, Bekasi Timur, Jawa Barat', 'full 10 hari', '081283774898', '1999-06-03', '2019-05-02 23:28:54', '2019-05-02 23:28:54'),
(314, 'Diah Rahmawati', NULL, '087771039786', 'Perempuan', 'Jl Bougenville no 92 Jatimulya Bekasi timur', 'full 10 hari', '081318983645', '1997-05-08', '2019-05-02 23:30:10', '2019-05-02 23:30:10'),
(315, 'Sori Masitoh', NULL, '085880995383', 'Perempuan', 'Jalan Melati Rata 1 no 4 rt 06 rw 01 kp bekasi kaum kecamatan bekasi timur kota bekasi 17112', 'full 10 hari', '08999814074', '1968-12-07', '2019-05-02 23:36:20', '2019-05-02 23:36:20'),
(316, 'Endang sulistiorini', NULL, '085312878500', 'Perempuan', 'Perum koperindag blok H no 4', 'full 10 hari', '081312110542', '1962-12-14', '2019-05-02 23:48:08', '2019-05-02 23:48:08'),
(317, 'Ayu Rizka khodariyah', NULL, '085211767914', 'Perempuan', 'Kp.kalijambe Rt.03/03 desa lambangsari kecamatan Tambun selatan No.50', 'full 10 hari', '081386467279', '1998-01-27', '2019-05-03 00:14:15', '2019-05-03 00:14:15'),
(318, 'Teguh Prasetyo', 'http://alikhlasdukuhbima.or.id/uploads/foto/671749535_03-05-2019_07:05:29.jpg', '087880123712', 'Laki-Laki', 'jl durian XIII no 3, Bumi Alam Hijau', 'pulang pergi', '087878701121', '1976-06-21', '2019-05-03 00:39:30', '2019-05-03 00:39:30'),
(319, 'Meli Amelia', NULL, '089622017639', 'Perempuan', 'Jl. Musholla  Al-Ikhlas RT.04 RW.02 Jatirasa, Jatiasih, Kota Bekasi', 'pulang pergi', '08988798320', '1993-12-15', '2019-05-03 00:59:58', '2019-05-03 00:59:58'),
(320, 'Maulana', 'http://alikhlasdukuhbima.or.id/uploads/foto/192502125_03-05-2019_09:05:57.jpg', '08881407091', 'Laki-Laki', 'Perum.Pesona Gading Cibitung 2 blok ab4/31 RT 005/020 wanajaya Cibitung', 'pulang pergi', '082111864370', '1975-10-31', '2019-05-03 02:01:57', '2019-05-03 02:01:57'),
(321, 'Endi hardoko', 'http://alikhlasdukuhbima.or.id/uploads/foto/749916394_03-05-2019_09:05:55.jpg', '081286409012', 'Laki-Laki', 'Kp.siluman rt02 rw 18 no:41, Desa mangun jaya, Kecamatan Tambun selatan, Kabupaten Bekasi', 'pulang pergi', '081299044366', '1964-06-26', '2019-05-03 02:28:55', '2019-05-03 02:28:55'),
(322, 'Farida Ayuningtyas', NULL, '08179147144', 'Perempuan', 'Jl. Teuku Umar No.126 Sepanjang Jaya, Bekasi - Jawa Barat', 'pulang pergi', '087887701772', '1983-12-06', '2019-05-03 02:38:20', '2019-05-03 02:38:20'),
(323, 'Nurhilaludin', 'http://alikhlasdukuhbima.or.id/uploads/foto/74736296_03-05-2019_10:05:38.jpg', '088210796196', 'Laki-Laki', 'Perumahan Grand residence Tirtayasa ac14/11', 'pulang pergi', '087879832601', '2007-01-01', '2019-05-03 03:13:38', '2019-05-03 03:13:38'),
(324, 'nurochim', NULL, '085886870543', 'Laki-Laki', 'kp rawa aren setia mekar tamsel', 'pulang pergi', '085772675913', NULL, '2019-05-03 04:56:22', '2019-05-03 04:56:22'),
(325, 'Serly Ovaria Putri', NULL, '082310999072', 'Perempuan', 'Perum Mutiara Gading Timur Blok P 11 / No 58 , Mustika JAya , Bekasi', 'pulang pergi', '087721224480', '1988-06-30', '2019-05-03 05:09:54', '2019-05-03 05:09:54'),
(326, 'Hanif ibnu mursyid', NULL, '08561319679', 'Laki-Laki', 'Kp. Jati mulya,  tambun selatan', 'pulang pergi', '085691795415', '2007-08-31', '2019-05-03 05:36:13', '2019-05-03 05:36:13'),
(327, 'Mursidi', NULL, '08561319679', 'Laki-Laki', 'Kp. Jati mulya,  tambun selatan', 'full 10 hari', '085691795415', '1976-07-12', '2019-05-03 05:40:11', '2019-05-03 05:40:11'),
(328, 'Dedy Supriyadi_abu fatih', 'http://alikhlasdukuhbima.or.id/uploads/foto/15645624_03-05-2019_13:05:56.jpg', '081288550466', 'Laki-Laki', 'Perumahan Graha Mustika Media blok.G11 no.56 Rt.004 Rw.011 Lubang buaya setu Bekasi', 'pulang pergi', '082113194644', '1978-12-01', '2019-05-03 06:56:56', '2019-05-03 06:56:56'),
(329, 'Rusdi Munandar', 'http://alikhlasdukuhbima.or.id/uploads/foto/630687714_03-05-2019_16:05:37.jpg', '0895606948327', 'Laki-Laki', 'Kp. Babakan rt. 001 rw. 02 no. 126 Kel. Mustika Sari  Kec.  Mustika Jaya. Kota Bekasi', 'full 10 hari', '089601148859', '1983-03-31', '2019-05-03 09:26:37', '2019-05-03 09:26:37'),
(330, 'Tuti Ita Kuswati', NULL, '083873425554', 'Perempuan', 'Jl.Hj. Halimah Saeran 1 No.5b, Depok', 'pulang pergi', '083898547390', '1995-08-20', '2019-05-03 13:13:38', '2019-05-03 13:13:38'),
(331, 'Ikrom Maulana', 'https://alikhlasdukuhbima.or.id/uploads/foto/182718755_03-05-2019_22:05:20.JPG', '087721224480', 'Laki-Laki', 'Perum Mutiara Gading Timur 2 Jalan Kenari Raya , Blok P11 / 58 Rt 01 / Rw 28 Kel.Mustika Jaya Kec. Mustika Jaya,Bekasi Timur - Jawa Barat', 'pulang pergi', '082310999072', '1987-08-30', '2019-05-03 15:49:20', '2019-05-03 15:49:20'),
(332, 'Hana Lentika Pratiwi', NULL, '082114358971', 'Perempuan', 'Taman Sentosa H1/38, Cukarang Selatan, Bekasi 17550', 'full 10 hari', '0811137314', '1998-12-10', '2019-05-03 18:32:26', '2019-05-03 18:32:26'),
(333, 'Ega Margareta Amelina', NULL, '083872962090', 'Perempuan', 'KP.CIBUNTU RT 001/008.Ds .CUBUNTU KEC.CIBITUNG-BEKASI 17520', 'full 10 hari', '081280529423', '1994-03-27', '2019-05-03 18:43:02', '2019-05-03 18:43:02'),
(335, 'Dedi Andika Bohari', 'http://alikhlasdukuhbima.or.id/uploads/foto/169732404_04-05-2019_02:05:23.jpg', '085399747949', 'Laki-Laki', 'Kampus politeknik kelapa sawit citra widya edukasi', 'full 10 hari', '085399747949', '1998-09-24', '2019-05-03 19:21:23', '2019-05-03 19:21:23'),
(336, 'BACHRUDDIN MUSTOFA', 'http://alikhlasdukuhbima.or.id/uploads/foto/871496289_04-05-2019_02:05:23.jpeg', '081297007260', 'Laki-Laki', 'JL CITARUM VII SIMPANGAN CIKARANG UTARA BEKASI', 'pulang pergi', '082114334751', '1979-04-09', '2019-05-03 19:29:23', '2019-05-03 19:29:23'),
(337, 'Supiana', 'http://alikhlasdukuhbima.or.id/uploads/foto/711811805_04-05-2019_03:05:13.jpg', '081511188538', 'Laki-Laki', 'Jl. Gugus Depan II No. 169 RT. 04 RW 04 Kelurahan Pengasinan Kecamatan Rawalumbu', 'full 10 hari', '081511188538', '1965-05-23', '2019-05-03 20:09:13', '2019-05-03 20:09:13'),
(338, 'Papat Fatimah', NULL, '081413278981', 'Perempuan', 'Jl. Gugus Depan II No. 169 RT 04 RW 04 Kelurahan Pengasinan Kecamatan Rawalumbu', 'full 10 hari', '081413278981', '1968-06-11', '2019-05-03 20:13:51', '2019-05-03 20:13:51'),
(339, 'Yuyun Rita Rahayu', NULL, '081315020254', 'Perempuan', 'Jl.Pasir Putih H no 222', 'pulang pergi', '081296480537', '1965-06-07', '2019-05-03 20:21:03', '2019-05-03 20:21:03'),
(340, 'Meyly Rusnatanty $', NULL, '08129648053', 'Perempuan', 'Jl.Teluk Bayur no 40. Kel.Spj jaya Bekasi', 'full 10 hari', '085717728395', '1965-05-28', '2019-05-03 20:22:29', '2019-05-03 20:22:29'),
(341, 'Sfafa Arbha Tiana', NULL, '081315020254', 'Perempuan', 'Jl.Pasir Putih H no 222', 'pulang pergi', '0812964805314', '2000-04-14', '2019-05-03 20:24:49', '2019-05-03 20:24:49'),
(342, 'Syauqi Arinal Haqqi', 'http://alikhlasdukuhbima.or.id/uploads/foto/928387879_04-05-2019_03:05:29.jpg', '081272084630', 'Laki-Laki', 'Politeknik kelapa sawit citra widya edukasi jl. Gapura no 08 cibuntu kec. Cibitung kab. Bekasi', 'pulang pergi', '085384892837', '1999-03-30', '2019-05-03 20:25:29', '2019-05-03 20:25:29'),
(343, 'Ihsan Imaduddin', NULL, '085710272811', 'Laki-Laki', 'Jl. Gugus Depan II No. 169 RT 04 RW 04 Kelurahan Pengasinan Kecamatan Rawalumbu', 'full 10 hari', '085710272811', '1996-05-02', '2019-05-03 20:25:34', '2019-05-03 20:25:34'),
(344, 'Ridwan Abdul Jabbar', NULL, '081809357974', 'Laki-Laki', 'Jl. Gugus Depan II No. 169 RT 04 RW 04 Kelurahan Pengasinan Kecamatan Rawalumbu', 'full 10 hari', '081809357974', '2000-04-11', '2019-05-03 20:27:18', '2019-05-03 20:27:18'),
(345, 'Zidni Ilman Makarim', NULL, '081818844504', 'Laki-Laki', 'Jl. Gugus Depan II No. 169 RT 04 RW 04 Kelurahan Pengasinan Kecamatan Rawalumbu', 'full 10 hari', '081818844504', '2003-03-22', '2019-05-03 20:29:06', '2019-05-03 20:29:06'),
(346, 'Aldino ceaser algaderi', NULL, '082267165537', 'Laki-Laki', 'Medan sumatra utara', 'pulang pergi', '81390988610', '1997-06-12', '2019-05-03 20:37:48', '2019-05-03 20:37:48'),
(347, 'Amal Mikail Luthfi', 'http://alikhlasdukuhbima.or.id/uploads/foto/971082905_04-05-2019_03:05:38.jpg', '089636616473', 'Laki-Laki', 'Jln. Muara baru Rt. 005 Rw. 03, Tanjung Barat, Jagakarsa, Jakarta Selatan', 'full 10 hari', '081311324602', '1999-11-20', '2019-05-03 20:38:39', '2019-05-03 20:38:39'),
(348, 'Yanti Rahmiati', NULL, '081284614776', 'Perempuan', 'Perum Bulak Kapal blok Gg no 43. Bekasi', 'full 10 hari', '08129648053', '1959-07-20', '2019-05-03 20:42:15', '2019-05-03 20:42:15'),
(349, 'Fahri Hamzah Januar', 'http://alikhlasdukuhbima.or.id/uploads/foto/889544538_04-05-2019_03:05:24.jpg', '083863547586', 'Laki-Laki', 'Purwakarta', 'full 10 hari', '083893240217', '1999-01-26', '2019-05-03 20:52:25', '2019-05-03 20:52:25'),
(350, 'Rapi Sandika', 'http://alikhlasdukuhbima.or.id/uploads/foto/824660805_04-05-2019_04:05:04.jpg', '08978012655', 'Laki-Laki', 'Jl. Setia darma 02, kp. Sawah bogo', 'full 10 hari', NULL, '2001-05-07', '2019-05-03 21:47:05', '2019-05-03 21:47:05'),
(351, 'Fairuzzabaady Matin', 'http://alikhlasdukuhbima.or.id/uploads/foto/256051885_04-05-2019_04:05:57.jpg', '08111553472', 'Laki-Laki', 'Razbi Prima Mansion, Blok C10. Jl. Wareng kalijambe, Lambang sari - Tambun Selatan. Kab.Bekasi', 'pulang pergi', '08118111795', '1983-04-18', '2019-05-03 21:54:57', '2019-05-03 21:54:57'),
(352, 'Zaenal Arifin', 'http://alikhlasdukuhbima.or.id/uploads/foto/253756972_04-05-2019_05:05:52.jpg', '08159161125', 'Laki-Laki', 'Jl. Gugus Depan H 174l3', 'pulang pergi', NULL, '1959-03-04', '2019-05-03 22:19:53', '2019-05-03 22:19:53'),
(353, 'Maryono', 'http://alikhlasdukuhbima.or.id/uploads/foto/598730845_04-05-2019_05:05:06.jpg', '08128186606', 'Laki-Laki', 'Buana V No. 17', 'pulang pergi', '02122105375', '1976-01-20', '2019-05-03 22:27:06', '2019-05-03 22:27:06'),
(354, 'Jaenal Arifin', NULL, '08128932282', 'Laki-Laki', 'Perumahan duta bumi 3 blok 3K-19 harapan indah', 'full 10 hari', '081210598357', '1977-04-02', '2019-05-03 22:32:02', '2019-05-03 22:32:02'),
(355, 'Siska purnama sari', NULL, '081367591670', 'Perempuan', 'Kp babakan bondol rt 002 rw 005 kelurahan mustika sari kec.mustika Jaya kota Bekasi', 'pulang pergi', '081367591670', '2000-06-15', '2019-05-03 22:40:32', '2019-05-03 22:40:32'),
(356, 'Muhammad ikhsan Dzaki', NULL, '08170142134', 'Laki-Laki', 'Kp jati RT 07/08 no 177 Jatimulya tambun selatan bekasi', 'pulang pergi', '081285453309', '2008-11-05', '2019-05-03 22:40:45', '2019-05-03 22:40:45'),
(357, 'Siti hapsah', NULL, '08999223797', 'Perempuan', 'Villa bekasi indah 2 blok L1 no 12A Rt 09 Rw 047 Sumberjaya Tambun Selatan Bekasi Jawa Barat', 'pulang pergi', '08129045572', '1977-03-15', '2019-05-03 22:43:48', '2019-05-03 22:43:48'),
(358, 'Fadhail Fieryansyah yusuf', NULL, '081519046204', 'Laki-Laki', 'Villa bekasi indah 2 blok L1 no 12A Rt 09 Rw 047 Sumberjaya Tambun Selatan Bekasi Jawa Barat', 'pulang pergi', '08129045572', '2005-05-21', '2019-05-03 22:46:33', '2019-05-03 22:46:33'),
(359, 'Agung priyambodo', 'http://alikhlasdukuhbima.or.id/uploads/foto/825776912_04-05-2019_05:05:51.jpg', '08111082052', 'Laki-Laki', 'Bima buana 10 no 67', 'pulang pergi', '081388633016', '1978-09-28', '2019-05-03 22:52:51', '2019-05-03 22:52:51'),
(360, 'Iswadi idris', NULL, '08170142134', 'Laki-Laki', 'Kp jati rt 07/08 no 177 Jatimulya tambun selatan bekasi', 'pulang pergi', '081285453309', NULL, '2019-05-03 23:00:44', '2019-05-03 23:00:44'),
(361, 'Deni Kurniawan', NULL, '085283732503', 'Laki-Laki', 'Mutiara gading timur 2 Blok N1 no 8C Mustika jaya. Kota Bekasi', 'pulang pergi', '081317662264', '1982-12-02', '2019-05-03 23:00:55', '2019-05-03 23:00:55'),
(362, 'Herman Hartadi', NULL, '081806033772', 'Laki-Laki', 'perum dukuh zamrud blok h no 16', 'pulang pergi', '081903515812', '1977-09-04', '2019-05-03 23:33:42', '2019-05-03 23:33:42'),
(363, 'Muhammad Fahmi', 'http://alikhlasdukuhbima.or.id/uploads/foto/231455461_04-05-2019_06:05:54.png', '081398337176', 'Laki-Laki', 'Kp. Tarikolot Rt. 03/ 01 Desa Tarikolot Kecamatan Citeureup 16810', 'pulang pergi', '081586576040', '1994-01-09', '2019-05-03 23:50:54', '2019-05-03 23:50:54'),
(364, 'Rahmat Jainal', 'http://alikhlasdukuhbima.or.id/uploads/foto/84473260_04-05-2019_06:05:29.jpg', '082183193383', 'Laki-Laki', 'Jl. Gapura No. 8 Kel. Rawa Banteng Desa Cibuntu Kec. Cibitung Kab. Bekasi Provinsi Jawa Barat', 'pulang pergi', NULL, '2000-07-21', '2019-05-03 23:52:29', '2019-05-03 23:52:29'),
(365, 'Katerin ayunda', NULL, '083815553646', 'Perempuan', 'Jalan raya kalimalang rt 03 rw 05 kampung cibuntu  kecamatan cibitung kab.bekasi', 'pulang pergi', '083818369259', '1995-03-24', '2019-05-04 00:37:41', '2019-05-04 00:37:41'),
(366, 'Bayu saputra', NULL, '083813869259', 'Laki-Laki', 'Jalan raya kalimalang rt 03 rw 05 kampung cibuntu  kecamatan cibitung kab.bekasi', 'pulang pergi', '083815553646', '1990-10-30', '2019-05-04 00:39:56', '2019-05-04 00:39:56'),
(367, 'Nofi Dwi Hermawan', 'https://alikhlasdukuhbima.or.id/uploads/foto/473096860_04-05-2019_08:05:15.jpeg', '08129956781', 'Laki-Laki', 'Dukuh Zamrud Blok i 20 no 25', 'pulang pergi', '0811800977', '1971-11-04', '2019-05-04 01:39:16', '2019-05-04 01:39:16'),
(368, 'Asmely Sikumbang', NULL, '081383999710', 'Perempuan', 'Kp. Pengasinan', 'full 10 hari', '08129648053', '1949-12-05', '2019-05-04 02:23:57', '2019-05-04 02:23:57'),
(369, 'Yulliza', NULL, '081298113007', 'Perempuan', 'Jl mandor demong rt 001 rw 03 no 106 mustikasari bekasi 17157', 'pulang pergi', '08568980714', '1990-07-10', '2019-05-04 02:27:45', '2019-05-04 02:27:45'),
(370, 'Aulia Nisrina Azzahra', NULL, '082299201188', 'Perempuan', 'bima citra 16 no.32 dukuh bima', 'full 10 hari', '0811951903', '2005-05-06', '2019-05-04 02:38:13', '2019-05-04 02:38:13'),
(371, 'Nindya andansari', NULL, '087782870394', 'Perempuan', 'Dukuh zamrud blok r 11 no 6', 'full 10 hari', '087782971443', '1993-10-11', '2019-05-04 02:40:33', '2019-05-04 02:40:33'),
(372, 'Danish rosian rafi', NULL, '087779175831', 'Laki-Laki', 'Pesona bumyagara blok f 18/15', 'pulang pergi', NULL, '2003-04-08', '2019-05-04 02:48:07', '2019-05-04 02:48:07'),
(373, 'JAMALUDIN', 'http://alikhlasdukuhbima.or.id/uploads/foto/889160845_04-05-2019_09:05:49.jpg', '085781543613', 'Laki-Laki', 'KP.PULO PUTER RT.003 RW.002 DESA SRIMAHI KECAMATAN TAMBUN UTARA KABUPATEN BEKASI', 'pulang pergi', '081511794405', '1983-10-14', '2019-05-04 02:58:49', '2019-05-04 02:58:49'),
(374, 'M Wahyu Furqoni', NULL, '081398389222', 'Laki-Laki', 'Dukuh bima Bima buana 18/9 lambangsari tambun selatan', 'pulang pergi', '6281912484874', '1981-07-17', '2019-05-04 03:10:38', '2019-05-04 03:10:38'),
(375, 'Garry VM', 'http://alikhlasdukuhbima.or.id/uploads/foto/853530527_04-05-2019_10:05:16.jpg', '081315147575', 'Laki-Laki', 'Village Bekasi Indah 2', 'pulang pergi', '081380202152', '1986-01-22', '2019-05-04 03:41:17', '2019-05-04 03:41:17'),
(376, 'Zaidan Rahman', 'http://alikhlasdukuhbima.or.id/uploads/foto/363674687_04-05-2019_10:05:00.', '089606293553', 'Laki-Laki', 'Kavling Tandang Mandiri - Kp. Lubangbuaya 03/08 Kec. Setu Kab. Bekasi', 'pulang pergi', '085711689960', '2000-12-06', '2019-05-04 03:45:00', '2019-05-04 03:45:00'),
(377, 'Nurul Anissa', NULL, '081281090442', 'Perempuan', 'Gang H. Adjid III, Rawalumbu. Bekasi', 'full 10 hari', '087715233531', '1995-08-22', '2019-05-04 04:26:28', '2019-05-04 04:26:28'),
(378, 'Redi murdiyono', 'http://alikhlasdukuhbima.or.id/uploads/foto/841916098_04-05-2019_11:05:33.jpg', '087883786592', 'Laki-Laki', 'Kp Lw malang,RT 007/001 sukaresmi kec.cikarang selatan kab.bekasi', 'pulang pergi', '6287804208225', '1992-01-16', '2019-05-04 04:43:33', '2019-05-04 04:43:33'),
(379, 'Achmad Kumala', 'http://alikhlasdukuhbima.or.id/uploads/foto/377901015_04-05-2019_11:05:02.jpg', '08161868914', 'Laki-Laki', 'Komp.Depkes 1, Husada 6, no.8 Jatibening bekasi', 'full 10 hari', '081229793350', '1965-07-25', '2019-05-04 04:49:02', '2019-05-04 04:49:02'),
(380, 'Sri Rezeki Dalimunthe', NULL, '082310478577', 'Perempuan', 'Pondok hijau permai, jl. Pinus III B4 No. 8, Rt.01 Rw.25. Kel. Pengasinan, Kec. Rawalumbu, Bekasi Timur 17115', 'pulang pergi', '081214786885', '1962-04-04', '2019-05-04 05:16:43', '2019-05-04 05:16:43'),
(381, 'Titin fatimah', NULL, '089610557701', 'Perempuan', 'Kp setu Desa telajung rt 02/01 kec.cikarang barar kab. Bekasi', 'pulang pergi', NULL, '1996-02-25', '2019-05-04 05:53:15', '2019-05-04 05:53:15'),
(382, 'Galuh dwi Cahyani', NULL, '085880127475', 'Perempuan', 'Jl.  B sidin perumahan cluster pesona lareno blok B no 18 kel. Mustika sari kec.  Mustika jaya bekasi timur', 'pulang pergi', '081319229414', '1998-08-13', '2019-05-04 06:11:12', '2019-05-04 06:11:12'),
(383, 'Muhammad Lukvin aziz', NULL, '085776526645', 'Laki-Laki', 'Perum vida bekasi jl.  Taman apel hijau ve blok a17 no 35 padurenan mustikajaya bekasi', 'pulang pergi', '081310713261', '1981-06-25', '2019-05-04 06:44:44', '2019-05-04 06:44:44'),
(384, 'NURUL FUTHU MUJADDIDAH', NULL, '08569944402', 'Perempuan', 'Jl Flamboyan kebon jeruk Jakarta barat', 'full 10 hari', '083175817361', '1999-07-30', '2019-05-04 06:47:18', '2019-05-04 06:47:18'),
(385, 'Ros Hernawati', NULL, '085779966603', 'Perempuan', 'Jl panda 1 blok d no 46 pondok timur indah', 'pulang pergi', '085710769399', '2000-12-28', '2019-05-04 07:01:18', '2019-05-04 07:01:18'),
(386, 'Fritzie Agasi', 'http://alikhlasdukuhbima.or.id/uploads/foto/973572362_04-05-2019_14:05:13.jpg', '087886589636', 'Laki-Laki', 'Perumahan Trias Estate blok B.12/24, Kab.bekasi', 'full 10 hari', '085287723208', '2000-08-19', '2019-05-04 07:14:13', '2019-05-04 07:14:13'),
(387, 'Dewi Umaiyah', NULL, '081296272966', 'Perempuan', 'Per.Grya Bekasi Permai blok. G. 19 No 33. Bekasi-Setu-Telajung', 'pulang pergi', '08980453067', '1958-11-23', '2019-05-04 07:17:16', '2019-05-04 07:17:16'),
(388, 'Rohmadi', NULL, '081385860818', 'Laki-Laki', 'Mekarsari permai 1 blok c1/28 kel. Mekarsari Tamsel bekasi', 'pulang pergi', '081310181210', '1967-10-12', '2019-05-04 07:35:48', '2019-05-04 07:35:48'),
(389, 'Aulia Wahyuni', NULL, '08989867415', 'Perempuan', 'Mangun Jaya Lestari 2, KB 07/07, RT 002/026. Mangun Jaya, Tambun Selatan. Bekasi, 17510.', 'pulang pergi', '6281311023431', '1999-08-09', '2019-05-04 07:54:07', '2019-05-04 07:54:07'),
(390, 'Yardinal', 'http://alikhlasdukuhbima.or.id/uploads/foto/594291111_04-05-2019_15:05:35.jpeg', '08118601254', 'Laki-Laki', 'Cluster acacia, summarecon bekasi, jl acacia 6 no bi-32', 'pulang pergi', '0218801342', '1980-01-16', '2019-05-04 08:47:35', '2019-05-04 08:47:35'),
(391, 'Tukiran', 'https://alikhlasdukuhbima.or.id/uploads/foto/847945156_04-05-2019_15:05:52.jpg', '085719874939', 'Laki-Laki', 'Perum vida jln durian 18 rt 07/16 padurenan mustika jaya bekasi', 'pulang pergi', '0815086740269', '1982-10-16', '2019-05-04 08:57:52', '2019-05-04 08:57:52'),
(392, 'Robi Wahyudi (Abu Alif)', NULL, '081808763633', 'Laki-Laki', 'Bima duta 15 no. 2 Tambun bekasi', 'full 10 hari', '081808763633', '1978-04-16', '2019-05-04 09:02:18', '2019-05-04 09:02:18'),
(393, 'Robby Wahyudi (Abu Alif)', 'http://alikhlasdukuhbima.or.id/uploads/foto/661101755_04-05-2019_16:05:36.jpg', '081808763633', 'Laki-Laki', 'Perum dukuh bima cluster Bima duta blok bd 15 no. 2 Tambun', 'full 10 hari', '08127207241', '1978-04-16', '2019-05-04 09:09:37', '2019-05-04 09:09:37'),
(394, 'Restu Aries Novianto', NULL, '089627629899', 'Laki-Laki', 'jl. harkit raya no. 09 RT 001/023 kel Harapan jaya kec Bekasi utara', 'full 10 hari', '089636708311', '1982-10-05', '2019-05-04 15:28:50', '2019-05-04 15:28:50'),
(395, 'Ratih Andriana Mutia', NULL, '08122072964', 'Perempuan', 'Grand Wisata Cluster Citrus Garden CD 3 no.6 tambun selatan bekasi', 'pulang pergi', '08122109724', '1980-06-08', '2019-05-04 15:31:42', '2019-05-04 15:31:42'),
(396, 'Rizki Fajar Ramdani', 'http://alikhlasdukuhbima.or.id/uploads/foto/242634322_04-05-2019_22:05:36.jpg', '085879674578', 'Laki-Laki', 'Griya asri 1 Blok D8/28. Tambun selatan. Kab. Bekasi', 'pulang pergi', '08567352000', '1998-01-13', '2019-05-04 15:57:36', '2019-05-04 15:57:36'),
(397, 'Maman Firmansyah', NULL, '087886688382', 'Laki-Laki', 'Grand wisata - Summer Festival blok ae2 no 3', 'pulang pergi', '6282213219576', NULL, '2019-05-04 15:58:48', '2019-05-04 15:58:48'),
(398, 'Jofanto Alfaj', NULL, '082112417511', 'Laki-Laki', 'Kp. Bulu Rt.04/03 No.32 Jl.Nurus Shobah 2, Setiap Mekar Tambun Selatan Bekasi', 'full 10 hari', '082391055194', '1999-08-14', '2019-05-04 16:13:11', '2019-05-04 16:13:11'),
(399, 'Arief Riski Indra Pratama', 'http://alikhlasdukuhbima.or.id/uploads/foto/319110868_04-05-2019_23:05:48.jpg', '081932481580', 'Laki-Laki', 'Jl betet blok b1/21 jatiasih bekasi', 'pulang pergi', '08125012466', '1999-07-16', '2019-05-04 16:13:49', '2019-05-04 16:13:49'),
(400, 'HARI WIDIJANTO', NULL, '081316937073', 'Laki-Laki', 'Cluster Mutiara Satria Blok i8 Satria Jaya Tambun Utara', 'full 10 hari', NULL, '1981-11-04', '2019-05-04 17:02:04', '2019-05-04 17:02:04'),
(401, 'M. Rofi Az Zikra', NULL, '089601148859', 'Laki-Laki', 'Kp. Babakan rt 01/02 kel. Mustika sari. Kec mustika jaya no. 126', 'full 10 hari', '0895606948327', '2008-03-11', '2019-05-04 17:18:50', '2019-05-04 17:18:50'),
(402, 'M AFRINALDI CHANDRA', NULL, '085691985994', 'Laki-Laki', 'Pondok timur indah 1. Jl panda 1 Blok D No. 45 RT.07/016 JATIMULYA, TAMBUN SELATAN, BEKASI', 'pulang pergi', '081286478443', '1994-03-12', '2019-05-04 17:55:22', '2019-05-04 17:55:22'),
(403, 'ade dwismanso', 'http://alikhlasdukuhbima.or.id/uploads/foto/127341259_05-05-2019_02:05:07.jpg', '081212264442', 'Laki-Laki', 'Taman wisma asri II, H21 no.6 Rt/Rw 09/28, bekasi utara 17121', 'full 10 hari', '089631658533', '1989-05-20', '2019-05-04 19:16:07', '2019-05-04 19:16:07'),
(404, 'Arief supriadi', 'http://alikhlasdukuhbima.or.id/uploads/foto/78222570_05-05-2019_02:05:15.jpg', '081770911429', 'Laki-Laki', 'Perum bumi lestari blok h60 no 20 tambun selatan', 'pulang pergi', '081905233021', '1978-04-05', '2019-05-04 19:32:15', '2019-05-04 19:32:15'),
(405, 'Meilani itasari', NULL, '085775228091', 'Perempuan', 'Desa Kendalrejo, Petarukan, pemalang', 'full 10 hari', '081284346935', '1996-09-01', '2019-05-04 20:27:58', '2019-05-04 20:27:58'),
(406, 'Wabiyo', NULL, '085883558845', 'Laki-Laki', 'Perum dukuh bima cluster bima asri jalan bima asri utama no 207 lambang sari tambun selatan', 'full 10 hari', '081234001775', '1944-04-12', '2019-05-04 21:15:59', '2019-05-04 21:15:59'),
(407, 'Sophan dwinanto', NULL, '081234001775', 'Laki-Laki', 'Perum dukuh bima cluster bima asri jalan bima asri utama no 207 Lambangsari Tambun selatan', 'full 10 hari', '081316372633', '1973-07-03', '2019-05-04 21:33:57', '2019-05-04 21:33:57'),
(408, 'Hanifah Nurazizah', NULL, '087743001274', 'Perempuan', 'Jl.pendidikan 3 Rt 06 Rw 01 no.162 Tambun, Tambun selatan, Bekasi', 'pulang pergi', '081282674740', '1999-11-26', '2019-05-04 21:47:11', '2019-05-04 21:47:11'),
(409, 'Lia Juariah', NULL, '081315078876', 'Perempuan', 'Perum Dukuh Bima, jl Buana 5 no.17. Lambang Sari, Tambun Selatan. Bekasi', 'pulang pergi', '08128186606', '1976-08-06', '2019-05-04 22:20:30', '2019-05-04 22:20:30'),
(410, 'Kevin Andaru widhi P', NULL, '087877422299', 'Laki-Laki', 'MGT blok G2 no 17 Mustika jaya Bekasi Timur', 'pulang pergi', '083874970162', '2008-05-30', '2019-05-04 22:36:49', '2019-05-04 22:36:49'),
(411, 'Ema Lasmawati', NULL, '085215450041', 'Perempuan', 'Domisili sementara cibuntu,Cibitung', 'full 10 hari', NULL, '1996-01-20', '2019-05-04 22:43:51', '2019-05-04 22:43:51'),
(412, 'Muhammad Iqbal L', NULL, '08129484717', 'Laki-Laki', 'jl bekasi timur IV no.19 rt.05/08 cipinang besar utara jakarta timur', 'full 10 hari', '081317123401', '1959-08-01', '2019-05-04 22:57:04', '2019-05-04 22:57:04'),
(413, 'Muhammad Raffi Rabbani', 'http://alikhlasdukuhbima.or.id/uploads/foto/672422044_05-05-2019_06:05:02.jpg', '08129017805', 'Laki-Laki', 'Jl. Bima Buana XI ano. 60, Dukuh Bima, Kota Legenda, Bekasi', 'pulang pergi', '0817215468', '2007-06-16', '2019-05-04 23:01:02', '2019-05-04 23:01:02'),
(414, 'Mohammad Aries Muharramsyah', 'http://alikhlasdukuhbima.or.id/uploads/foto/650702517_05-05-2019_06:05:13.jpg', '0817215468', 'Laki-Laki', 'Jl. Bima Buana XI ano. 60, Dukuh Bima, Kota Legenda, Bekasi', 'pulang pergi', '08111689321', '1968-04-15', '2019-05-04 23:06:13', '2019-05-04 23:06:13'),
(415, 'Arsih', NULL, '085720955187', 'Perempuan', 'Kp. Cohanggasa, desa kertamukti, kecamatan sumur, kabupaten pandeglang, banten', 'pulang pergi', '083818701737', '1893-07-05', '2019-05-04 23:21:55', '2019-05-04 23:21:55'),
(416, 'Edy Kennedy', 'http://alikhlasdukuhbima.or.id/uploads/foto/721764669_05-05-2019_07:05:44.jpg', '087817092425', 'Laki-Laki', 'Kp.kalenderwak Rt.02/02 Ds.Karangsari Kec.Cikarang timur Kab.Bekasi', 'pulang pergi', '087875069669', '1992-12-29', '2019-05-05 00:25:44', '2019-05-05 00:25:44'),
(417, 'Fadli kuncoro', 'http://alikhlasdukuhbima.or.id/uploads/foto/946526138_05-05-2019_07:05:17.jpg', '081282348244', 'Laki-Laki', 'Jln Setia No 15 RT07 RW01 Bojong Rawalumbu Bekasi', 'pulang pergi', '082134822368', '1995-09-11', '2019-05-05 00:51:17', '2019-05-05 00:51:17'),
(418, 'Alif Ilham', 'http://alikhlasdukuhbima.or.id/uploads/foto/8055746_05-05-2019_07:05:56.jpg', '082210324347', 'Laki-Laki', 'Bekasi timur regensi blok h 22 no 28', 'pulang pergi', '081210902416', '1998-07-30', '2019-05-05 00:57:56', '2019-05-05 00:57:56'),
(419, 'Marzain Ardiantoro', 'http://alikhlasdukuhbima.or.id/uploads/foto/53471713_05-05-2019_08:05:58.jpg', '085972853097', 'Laki-Laki', 'Bima Asri 15 a', 'pulang pergi', '085213173864', '1971-10-24', '2019-05-05 01:07:58', '2019-05-05 01:07:58'),
(420, 'Winda sri hayati', NULL, '089652116770', 'Perempuan', 'Jln.kav h darmansyah no.288 gg.amal rt04/rw10 margahayu bekasi timur', 'pulang pergi', '08973563053', '2001-03-17', '2019-05-05 01:52:46', '2019-05-05 01:52:46'),
(421, 'Lukman hakim', NULL, '081316156387', 'Laki-Laki', 'Perumahan dukuh zambrud blom n1 no 6', 'full 10 hari', '082146237741', '2007-08-23', '2019-05-05 02:28:37', '2019-05-05 02:28:37'),
(422, 'Ahmad Zaky Maryadi', 'http://alikhlasdukuhbima.or.id/uploads/foto/997693393_05-05-2019_09:05:21.jpg', '082123310507', 'Laki-Laki', 'Mutiara Gading Timur Blok F10/38. RT.008/33', 'pulang pergi', '081388647097', '1977-10-14', '2019-05-05 02:36:21', '2019-05-05 02:36:21'),
(423, 'Suherman', 'http://alikhlasdukuhbima.or.id/uploads/foto/679169445_05-05-2019_09:05:47.jpeg', '085694804328', 'Laki-Laki', 'Jalan rawa semut gang semut indah 3 bekasi timur', 'pulang pergi', '085774202020', '1986-02-27', '2019-05-05 02:43:47', '2019-05-05 02:43:47'),
(424, 'Noer Ifna', NULL, '081388647097', 'Perempuan', 'Mutiara Gading Timur Blok F10/38. RT.008/33', 'pulang pergi', '082123310507', '1983-11-06', '2019-05-05 02:44:09', '2019-05-05 02:44:09'),
(425, 'Rizqi tri wijayanti', NULL, '085774202020', 'Perempuan', 'Jalan rawa semut gang semut indah 3 bekasi timur', 'pulang pergi', '085694804328', '1986-09-12', '2019-05-05 02:45:26', '2019-05-05 02:45:26'),
(426, 'Wulandari', NULL, '083818701737', 'Perempuan', 'Kecamatan sumur, kabupaten pandeglang, banten', 'full 10 hari', '083808559757', '2004-04-16', '2019-05-05 02:52:56', '2019-05-05 02:52:56'),
(427, 'Sahrul muharom', 'http://alikhlasdukuhbima.or.id/uploads/foto/410947322_05-05-2019_09:05:55.jpg', '083808559757', 'Laki-Laki', 'Kecamatan sumur kabupaten pandeglang banten', 'full 10 hari', '085720955187', '2004-02-03', '2019-05-05 02:54:55', '2019-05-05 02:54:55'),
(428, 'Sutrisno ibnu syahlan', 'http://alikhlasdukuhbima.or.id/uploads/foto/242063264_05-05-2019_10:05:26.jpg', '081281003050', 'Laki-Laki', 'Graha prima T5-26 MangunJaya Tambun Selatan', 'full 10 hari', '081314470106', '1967-08-02', '2019-05-05 03:05:26', '2019-05-05 03:05:26'),
(429, 'Ariwardoyo Abu faqih', NULL, '081318507363', 'Laki-Laki', 'kpm siluman..', 'pulang pergi', '083894865297', '1975-06-06', '2019-05-05 03:34:21', '2019-05-05 03:34:21'),
(430, 'Rakasa Divalri Putra', 'http://alikhlasdukuhbima.or.id/uploads/foto/543081539_05-05-2019_10:05:07.jpeg', '087797655997', 'Laki-Laki', 'Jl. Babakan Cihapit No.131 Rt. 07 Rw. 06 Padasuka, Cicaheum, Kota Bandung', 'pulang pergi', '081289480284', '1997-04-16', '2019-05-05 03:39:07', '2019-05-05 03:39:07'),
(431, 'Wardah', NULL, '081586740269', 'Perempuan', 'Jln durian 18 rt07/16 BAH perum vida D1/32 padurenan muatika jaya bekasi', 'full 10 hari', '085719874939', '1982-12-18', '2019-05-05 04:26:12', '2019-05-05 04:26:12'),
(432, 'Imro\'atus Sholikhah', NULL, '08811959247', 'Perempuan', 'Jln wareng kalijambe RT 02 RW 03 desa lambangsari tambun', 'pulang pergi', '08811959247', '1998-06-05', '2019-05-05 04:39:00', '2019-05-05 04:39:00'),
(433, 'Rikawati', '', '081213461240', 'Perempuan', 'Kp.Lubang buaya RT.05 RW.01 no.46, Setu Kab.Bekasi', 'full 10 hari', '081295499089', '1993-09-18', '2019-05-05 04:50:12', '2019-05-05 04:50:12'),
(434, 'Ampisari', NULL, '082394578813', 'Laki-Laki', 'Sulawesi barat', 'full 10 hari', NULL, NULL, '2019-05-05 06:15:05', '2019-05-05 06:15:05'),
(435, 'Agus suprapto', 'https://alikhlasdukuhbima.or.id/uploads/foto/265386254_05-05-2019_13:05:51.jpg', '082260246144', 'Laki-Laki', 'blok N17/21 RT 01/029 MGT', 'full 10 hari', '085697414058', '1967-08-14', '2019-05-05 06:53:51', '2019-05-05 06:53:51'),
(436, 'Rely kusnandar', 'http://alikhlasdukuhbima.or.id/uploads/foto/266514927_05-05-2019_14:05:47.jpg', '081932121821', 'Laki-Laki', 'Bekasi regensi2 blok dd7 no3, wanasari cibitung bekasi', 'pulang pergi', '081905322239', '1969-09-12', '2019-05-05 07:22:47', '2019-05-05 07:22:47'),
(437, 'Winda sri', 'http://alikhlasdukuhbima.or.id/uploads/foto/794329575_05-05-2019_14:05:37.jpg', '089652116770', 'Perempuan', 'Jln.kav h darmansyah no.288 gg.amal rt04/rw10 margahayu bekasi timur', 'pulang pergi', '08973563053', '2001-03-17', '2019-05-05 07:25:37', '2019-05-05 07:25:37'),
(438, 'Adlin Mas Hadi Waluyo', 'http://alikhlasdukuhbima.or.id/uploads/foto/864472409_05-05-2019_14:05:34.jpg', '085210119133', 'Laki-Laki', 'Perumahan Griya Pratama Mas Blok D3 no 2, RT.05 RW.007 Desa. Cikarageman ,Kec.Setu Kab. Bekasi', 'pulang pergi', '081388559913', '1997-03-09', '2019-05-05 07:26:34', '2019-05-05 07:26:34'),
(439, 'Muhammad Haikal Saifullah', 'http://alikhlasdukuhbima.or.id/uploads/foto/205123998_05-05-2019_14:05:46.jpg', '081932121821', 'Laki-Laki', 'Bekasi regensi2 blok dd7 no3, wanasari cibitung bekasi', 'pulang pergi', '081905322239', '2004-03-07', '2019-05-05 07:31:47', '2019-05-05 07:31:47'),
(440, 'Ikko Rossalia Putri', NULL, '081388134030', 'Perempuan', 'Jln H romli no 70 pondok hijau permai', 'pulang pergi', '085102233405', '2001-04-19', '2019-05-05 07:32:32', '2019-05-05 07:32:32'),
(441, 'Suci sukhmawati putri', NULL, '089501182340', 'Perempuan', 'Graha harapan Blok E 10 No 44', 'pulang pergi', '089501182340', '1999-03-06', '2019-05-05 08:03:51', '2019-05-05 08:03:51'),
(442, 'Yuda Ovanda', 'http://alikhlasdukuhbima.or.id/uploads/foto/376000816_05-05-2019_15:05:46.jpg', '081289480284', 'Laki-Laki', 'Jl umar no 52, mustika jaya bekasi', 'pulang pergi', '085758704346', '2008-02-07', '2019-05-05 08:08:46', '2019-05-05 08:08:46'),
(443, 'Arifa kurniasari', NULL, '085287277878', 'Perempuan', 'Perumahan vila asri blok Q no 9', 'full 10 hari', '081210641712', '1970-04-07', '2019-05-05 08:49:38', '2019-05-05 08:49:38'),
(444, 'Aulianne farah anissa', NULL, '089529402647', 'Perempuan', 'Perumahan vila asri blok Q no 9', 'full 10 hari', '085287277878', '2001-03-31', '2019-05-05 08:51:08', '2019-05-05 08:51:08'),
(445, 'Z a e n a l', 'http://alikhlasdukuhbima.or.id/uploads/foto/81318970_05-05-2019_16:05:59.jpg', '081385888549', 'Laki-Laki', 'Bekasi Timur Regency lll. Cluster Graned G6/2', 'full 10 hari', NULL, NULL, '2019-05-05 09:12:59', '2019-05-05 09:12:59'),
(446, 'Resita Amy Nurfana', NULL, '087806484802', 'Perempuan', 'Kp. Jagawana RT 05 RW 05 Gang Mawar 3 Desa Sukarukun Kec. Sukatani Cikarang Utara Kab. Bekasi Jawa Barat 17630', 'pulang pergi', '087711060673', '1999-11-29', '2019-05-05 09:46:42', '2019-05-05 09:46:42'),
(447, 'Muhammad Badri Halim', 'https://alikhlasdukuhbima.or.id/uploads/foto/59770079_05-05-2019_17:05:01.png', '08122109724', 'Laki-Laki', 'Grand Wisata Citrus Garden', 'pulang pergi', '081214514524', '1980-03-29', '2019-05-05 10:02:01', '2019-05-05 10:02:01'),
(448, 'Robiatul Adawiyyah', NULL, '081284178019', 'Perempuan', 'Jln. Lumbu Timur Raya Jembatan 13 Blok X RT 05 RW 32 no. 38 Kel. Bojong Rawa Lumbu', 'pulang pergi', '089624266826', '2003-02-04', '2019-05-05 10:05:22', '2019-05-05 10:05:22'),
(449, 'Dzulfikri Nurmujahid Iskandar', 'http://alikhlasdukuhbima.or.id/uploads/foto/835726161_05-05-2019_21:05:43.jpg', '089666779991', 'Laki-Laki', 'Perumahan Mangunjaya Indah 2, Blok c8/7, Rt 002/015', 'full 10 hari', '6282122849323', '1993-05-28', '2019-05-05 14:07:43', '2019-05-05 14:07:43'),
(450, 'Siti Anisatur Rohmah', NULL, '085729383970', 'Perempuan', 'Griya kota Bekasi 2 Blok C5 no.3  Satria Mekar, Tambun Utara', 'pulang pergi', '0895405793400', '1997-01-23', '2019-05-05 14:31:35', '2019-05-05 14:31:35'),
